Bank,First_Active_Month,Last_Active_Month
siddaganga urban cooperative bank limited,2024-04-01,2025-10-01
siddheshwar sahakari bank limited latur,2024-04-01,2025-10-01
siddheshwar urban cooperative bank limited,2024-04-01,2025-10-01
siddheshwar urban cooperative bank limited sillod,2024-04-01,2025-10-01
siddheswar sahakari bank,2024-04-01,2025-10-01
sihor mercantile cooperative bank limited,2024-04-01,2025-10-01
sihor nagarik sahakari bank,2024-04-01,2025-10-01
sikar kendriya sahakari bank limited,2024-04-01,2025-10-01
sikar kendriya sahakari bank limited sikar,2024-04-01,2025-10-01
sikkim state cooperative bank limited,2024-04-01,2025-10-01
sindhudurg dccb,2024-04-01,2025-10-01
sindhudurg district central cooperative bank limited,2024-04-01,2025-10-01
sindhudurg district central cooperative bank limited sindhudurg,2024-04-01,2025-10-01
sindhudurg sahakari bank limited mumbai,2024-04-01,2025-10-01
sir m vishweshwaraiah sahakar bank niyamitha,2024-04-01,2025-10-01
sir m visvesvaraya cooperative bank limited,2024-04-01,2025-10-01
slice small finance bank limited,2025-06-01,2025-10-01
smriti nagrik sahakari bank limited,2024-04-01,2025-10-01
smriti nagrik sahakari bank limited mandsaur,2024-04-01,2025-10-01
societe generale bank,2024-04-01,2025-10-01
solapur d c c bank,2024-04-01,2025-10-01
solapur janata sahakari bank limited,2024-04-01,2025-10-01
solapur siddheshwar sahakari bank limited,2024-04-01,2025-10-01
solapur siddheshwar sahakari bank limited solapur,2024-04-01,2025-09-01
solapur social urban cooperative bank,2024-04-01,2025-10-01
sonali bank limited,2024-04-01,2024-04-01
sonali bank plc,2024-05-01,2025-10-01
sonbhadra nagar sahakari bank limited,2024-04-01,2025-10-01
sonebhadra nagar sahakari bank limited,2024-04-01,2025-10-01
soubhagya mahila souharda sahakari bank niyamith gadag,2025-03-01,2025-09-01
soubhagya mahila souhardha sahakari bank niyamith,2024-04-01,2025-10-01
spice digital limited,2025-04-01,2025-09-01
spice money limited,2024-04-01,2025-10-01
sree bhyraveshwara sahakara bank niyamitha,2024-04-01,2025-09-01
sree charan souhardha cooperative bank limited,2024-04-01,2025-10-01
sree harihareshwara urban cooperative bank limited,2024-04-01,2025-10-01
sree mahayogi lakshmamma cooperative bank limited,2024-04-01,2025-10-01
sree subramanyeswara cooperative bank limited,2024-04-01,2025-10-01
sree thyagaraja cooperative bank limited,2024-04-01,2025-10-01
sree tukaram cooperative bank limited,2024-04-01,2025-10-01
sreenidhi souharda sahakari bank niyamitha,2024-04-01,2025-10-01
sreenivasa padmavathi cooperative urban bank limited,2024-05-01,2025-10-01
sri ambabhavani urban cooperative bank limited,2024-04-01,2025-10-01
sri banashankari mahila cooperative bank limited,2024-04-01,2025-09-01
sri basaveshwar pattana sahakari bank niya sindgi,2024-05-01,2025-10-01
sri basaveshwar sahakar bank niyamita,2024-04-01,2025-10-01
sri basaveshwara pattana sahakara bank niyamitha,2024-04-01,2025-10-01
sri bhagwathi cooperative urban bank,2024-04-01,2025-10-01
sri channabasavaswamy souharda sahakari bank niyam,2024-04-01,2025-10-01
sri channabasavaswamy souhardha sahakari bank ni,2024-04-01,2025-09-01
sri channabasavaswamy souhardha sahakari bankniyamit,2025-02-01,2025-10-01
sri ganapathi urban cooperative bank limited,2024-04-01,2025-10-01
sri ganesh cooperative bank limited,2024-04-01,2025-10-01
sri ganesh cooperative bank limited gulbarga,2024-04-01,2025-10-01
sri gokarnanath cooperative bank limited,2024-04-01,2025-10-01
sri kamalambika cooperative urban bank limited,2024-04-01,2025-10-01
sri kannikaparameshwari cooperative bank limited,2024-04-01,2025-10-01
sri kanyakaparameshwari cooperative bank limited,2024-04-01,2025-10-01
sri kanyakaparameswari cooperative bank limited,2024-04-01,2025-10-01
sri kanyakaparameswari cooperative bank limited mysore,2024-04-01,2025-10-01
sri krishnarajendra cooperative bank limited,2024-04-01,2025-10-01
sri lakshmi mahila sahakara bank niyamitha,2024-04-01,2025-10-01
sri lakshmi narayana cooperative urban bank limited,2024-04-01,2025-10-01
sri lakshminarayana cooperative bank limited,2024-04-01,2025-10-01
sri potti sri ramulu nellore district cooperative central bank,2024-04-01,2025-10-01
sri potti sri ramulu nellore dst cooperative central ban,2024-04-01,2025-10-01
sri potti sriramulu nellore dccb,2024-08-01,2025-10-01
sri rama cooperative bank limited,2024-04-01,2025-10-01
sri satya sai nagrik sahakari bank limited,2024-11-01,2025-09-01
sri satya sai nagrik sahakari bank mydl,2024-04-01,2025-10-01
sri satya sai nagrik sahakari bank mydt,2024-04-01,2025-10-01
sri seetharaghava souharda sahakara bank niyamitha,2024-04-01,2025-10-01
sri siddarameshwara sahakara bank niyamitha,2024-04-01,2025-10-01
sri sudha cooperative bank limited,2024-04-01,2025-10-01
sri vasavamba cooperative bank limited,2024-04-01,2025-10-01
sri veerabhadreshwar cooperative bank limited,2025-01-01,2025-06-01
sriramanagar pattana sahakara bank ni sriramanagar,2024-04-01,2025-09-01
sriramnagar pattana sahakara bank niyamith,2024-04-01,2025-10-01
standard charterd bank,2024-04-01,2025-10-01
standard chartered bank,2024-04-01,2025-10-01
standard urban cooperative bank aurangabad limited,2024-04-01,2025-10-01
standard urban cooperative bank limited,2024-04-01,2025-09-01
state bank of india,2024-04-01,2025-10-01
state bank of travancore,2024-04-01,2025-09-01
state transport cooperative bank limited,2024-04-01,2025-09-01
sterling urban cooperative bank limited,2024-04-01,2025-10-01
suco souharad sahakaribank,2024-04-01,2025-10-01
suco souharda sahakari bank imps,2024-04-01,2025-10-01
suco souharda sahakari bank limited,2024-04-01,2025-10-01
sudha cooperative urban bank limited,2024-04-01,2025-10-01
suleimani cooperative bank limited,2024-04-01,2025-10-01
sumitomo mitsuianking corporation,2024-04-01,2025-10-01
sundargarh central cooperative bank limited,2024-04-01,2025-10-01
sundargarh district central cooperative bank limited sundargarh,2024-04-01,2025-10-01
sundarlal savji cooperative bank,2024-04-01,2025-10-01
sundarlal sawaji urban cooperative bank limited,2024-04-01,2025-10-01
sundarlal sawji urban cooperative bank limited,2024-04-01,2025-10-01
sunderlal sawji urban cooperative bank limited jintur,2024-04-01,2025-10-01
surat dist cooperative bank limited,2024-04-01,2025-10-01
surat merc cooperative bank limited,2024-04-01,2025-10-01
surat national cooperative bank limited,2024-04-01,2025-10-01
suryoday small fianance bank,2024-04-01,2025-10-01
suryoday small finance bank limited,2024-04-01,2025-10-01
suvarna cooperative bank limited,2024-04-01,2025-10-01
suvarnayug sahakari bank limited,2024-04-01,2025-10-01
svc cooperative bank limited,2024-04-01,2025-10-01
swami vivekanand sahakari bank niyamit,2025-01-01,2025-01-01
swarna bharathi sahakara bank niyamita,2024-04-01,2025-10-01
swatantrya senani late shripal alase kaka kurundwad urban cooperative bank limited kurundwad,2024-04-01,2025-10-01
swatantrya senani lt kurundwad urban cooperative bank lt,2024-04-01,2025-10-01
tamil nadu grama bank,2024-04-01,2025-10-01
tamilnad mercantile bank limited,2024-04-01,2025-10-01
tamilnadu grama bank erstwhile pallavan grama bank,2024-04-01,2025-10-01
tamluk ghatal central cooperative bank limited,2024-04-01,2025-10-01
tarapur cooperative urban bank limited,2024-04-01,2025-10-01
tata communications,2025-10-01,2025-10-01
tavaragera pattana souharda sahakarabankniyamitha,2024-04-01,2025-10-01
teachers cooperative bank limited,2024-04-01,2025-10-01
tehri garhwal zila sahakari bank limited,2024-04-01,2025-10-01
telangana grameena bank,2024-04-01,2025-10-01
telangana state cooperative apex bank limited,2024-04-01,2025-10-01
tellicherry cooperative urban bank limited,2024-04-01,2025-10-01
telngana gramin bank,2024-04-01,2025-10-01
terna nagari sahakari bank limited osmanabad,2024-04-01,2025-10-01
textile cooperative bank limited,2024-04-01,2025-10-01
textile traders cooperative bank limited,2024-04-01,2025-10-01
textile trders cooperative bank limited,2024-04-01,2024-12-01
thane bharat sahakari bank limited,2024-04-01,2025-10-01
thane janata sahakari bank,2024-04-01,2025-10-01
thanjavur district central cooperative bank,2024-04-01,2025-10-01
the a p mahesh cooperative urban bank limited,2024-04-01,2025-10-01
the a p raja rajeswari mahila cooperative urban bank limited,2024-04-01,2025-10-01
the abhinav sahakari bank limited,2024-04-01,2025-10-01
the accountant general office employees cooperative bank limited,2024-04-01,2025-10-01
the accountant general office employees cooperativebank limited,2025-04-01,2025-10-01
the accountant general s office employees cooperative bank limited,2024-04-01,2025-09-01
the adarsh cooperative urban bank limited,2024-04-01,2025-10-01
the adarsha pattana souhardha sahakari bank,2024-04-01,2025-10-01
the adilabad district cooperative central bank limited,2024-04-01,2025-10-01
the adilabad district cooperative central bank limited adilabad,2024-04-01,2025-10-01
the adilabad district cooperative centralbank limited,2024-04-01,2025-10-01
the adinath cooperative bank limited,2024-04-01,2025-09-01
the agrasen cooperative urban bank limited,2024-04-01,2025-10-01
the agrasen nagari sahakari bank limited,2024-04-01,2025-10-01
the agrasen nagari sahakari bank limited akola,2024-04-01,2025-10-01
the ahmedabad district cooperative bank limited,2024-04-01,2025-10-01
the ahmedabad mercantile cooperative bank limited,2024-04-01,2025-10-01
the ahmednagar district central cooperative bank limited,2024-04-01,2025-10-01
the ahmednagar merchant s cooperative bank limited ahmednagar,2024-04-01,2025-10-01
the ajara urban cooperative bank limited,2024-04-01,2025-10-01
the ajara urban cooperative bank limited ajara,2024-04-01,2025-10-01
the akki alur urban cooperative bank limited,2024-04-01,2025-10-01
the akola district central cooperative bank limited,2024-04-01,2025-10-01
the akola district central cooperative bank limited akola,2024-04-01,2025-10-01
the akola janata commercial cooperative bank limited,2024-04-01,2025-10-01
the akola janta comm cooperative bank,2024-04-01,2025-10-01
the akola janta commercial cooperative bank limited,2024-04-01,2025-10-01
the akola urban cooperative bank limited,2024-04-01,2025-10-01
the akola urban cooperative bank limited akola,2024-04-01,2025-09-01
the akola washim district central cooperative bank limited akola,2025-10-01,2025-10-01
the alleppey urban cooperative bank limited,2024-04-01,2025-10-01
the alnavar urban cooperative bank limited,2024-04-01,2025-10-01
the alwar central cooperative bank limited,2024-04-01,2025-10-01
the alwar central cooperative bank limited alwar,2024-04-01,2025-03-01
the amalner cooperative urban bank limited,2024-04-01,2025-10-01
the ambala central cooperative bank limited,2024-04-01,2025-10-01
the ambika mahila sahakari bank limited,2024-04-01,2025-10-01
the ambika mahila sahakari bank limited ahmednagar,2024-04-01,2025-10-01
the amod nagrik cooperative bank limited,2024-04-01,2025-10-01
the amravati district central cooperative bank limited,2024-04-01,2025-10-01
the amravati zilla parishad shikshak sahakari bank limited,2024-04-01,2025-10-01
the amreli jilla madhyastha sahakari bank limited,2024-04-01,2025-10-01
the amritsar central cooperative bank limited,2024-04-01,2025-10-01
the amritsar central cooperative bank limited amritsar,2024-04-01,2025-10-01
the anand mercantile cooperative bank limited,2024-04-01,2025-10-01
the anantapur district cooperative central bank l,2024-04-01,2025-10-01
the anantnag central cooperative bank limited,2024-04-01,2025-10-01
the anantpur district cooperative central bank limited,2024-04-01,2025-10-01
the andhra pradesh state cooperative bank limited,2024-04-01,2025-10-01
the andhra pragathi grameena bank limited,2024-04-01,2025-10-01
the angul united central cooperative bank limited,2024-04-01,2025-10-01
the angul united central cooperative bank limited angul,2024-04-01,2025-10-01
the ankola urban cooperative bank limited,2024-04-01,2025-10-01
the annasaheb savant cooperative urban bank mahad limited,2024-04-01,2025-10-01
the annasaheb savant cooperative urban bank mahad limited mahad,2024-04-01,2025-10-01
the arsikere urban cooperative bank limited,2024-04-01,2025-10-01
the arunachal pradesh state cooperative apex bank limited,2024-04-01,2025-10-01
the aryapuram cooperative urban bank limited,2024-04-01,2025-10-01
the aryapuram cooperative urban bank limited rajahmundry atm,2024-04-01,2025-10-01
the ashta people s cooperative bank limited ashta,2024-04-01,2025-10-01
the ashta peoples cooperative bank limited,2024-04-01,2025-10-01
the aska cooperative central bank limited,2024-04-01,2025-10-01
the aska cooperative central bank limited aska,2025-02-01,2025-10-01
the aska cooperative central bank limited aska ganjam,2024-04-01,2025-10-01
the assam cooperative apex bank limited,2024-04-01,2025-10-01
the associate cooperative bank limited,2024-04-01,2025-10-01
the aurangabad dccb limited,2024-04-01,2025-10-01
the aurangabad district central cooperative bank limited,2024-04-01,2025-10-01
the aurangabad district central cooperative bank limited aurangabad bihar,2024-04-01,2025-10-01
the azad cooperative bank limited,2024-04-01,2025-10-01
the azad cooperative bank limited gadag,2024-04-01,2025-10-01
the azad urban cooperative bank limited,2024-04-01,2025-10-01
the b komarapalayam cooperative urban bank limited,2024-04-01,2025-10-01
the babasaheb deshmukh sahakari bank limited,2024-04-01,2025-10-01
the babasaheb deshmukh sahakari bank limited atpadi,2024-04-01,2025-10-01
the badagara cooperative urban bank limited,2024-04-01,2025-10-01
the bagalkot cooperative bank limited,2024-04-01,2025-10-01
the bagalkot district central cooperative bank limited,2024-04-01,2025-10-01
the bagalkot district central cooperative bank lt,2024-04-01,2025-10-01
the baghat urban cooperative bank limited,2024-04-01,2025-10-01
the bailhongal urban cooperative bank limited,2024-04-01,2025-10-01
the balangir district central cooperative bank limited,2024-04-01,2025-10-01
the balasore bhadrak central cooperative bank limited,2024-04-01,2025-10-01
the balasore bhadrak central cooperative bank limited balasore,2024-04-01,2025-10-01
the balasore cooperative urban bank limited,2024-04-01,2025-10-01
the balotra urban cooperative bank limited,2024-04-01,2025-10-01
the balusseri cooperative urban bank limited,2024-04-01,2025-10-01
the balusseri cooperative urban bank limited noll27,2025-04-01,2025-10-01
the banaskantha dccb limited,2024-04-01,2025-10-01
the banaskantha district central cooperative bank limited,2024-04-01,2025-10-01
the banaskantha mercantile cooperative bank limited,2024-04-01,2025-10-01
the banaskatha mercantile cooperative bank limited,2024-04-01,2025-10-01
the bangalore bangalore rural and ramanagara district central cooperative bank limited,2024-04-01,2025-10-01
the bangalore city cooperative bank limited,2024-04-01,2025-10-01
the banki central cooperative bank limited,2024-04-01,2025-10-01
the banki central cooperative bank limited banki,2024-04-01,2025-10-01
the bankura town cooperative bank limited,2024-04-01,2025-10-01
the banswara central cooperative bank limited,2024-04-01,2025-10-01
the bantra cooperative bank limited,2024-04-01,2025-10-01
the bapuji cooperative bank limited,2024-04-01,2025-10-01
the bapunagar mahila cooperative bank limited,2024-04-01,2025-10-01
the baramati sahakari bank limited,2024-04-01,2025-10-01
the baran nagrik sahakari bank limited,2024-04-01,2025-10-01
the bardoli nagrik sahakari bank limited,2024-04-01,2025-10-01
the barmer central cooperative bank limited,2024-04-01,2025-10-01
the barmer central cooperative bank limited barmer,2024-04-01,2025-09-01
the baroda central cooperative bank limited,2024-04-01,2025-10-01
the baroda city cooperative bank limited,2024-04-01,2025-10-01
the bathinda central cooperative bank limited,2024-04-01,2025-10-01
the bathinda central cooperative bank lt bathinda,2024-04-01,2025-10-01
the bavla nagrik sahakari bank limited,2024-04-01,2025-10-01
the becharaji nagarik sahakari bank limited,2024-04-01,2025-09-01
the bechraji nagarik sahakari bank limited,2024-04-01,2025-10-01
the beed district central cooperative bank limited,2024-04-01,2025-10-01
the begusarai central cooperative bank limited,2024-04-01,2025-10-01
the belagavi district central cooperative bank limited,2024-04-01,2025-10-01
the belgaum district revenue employess cooperative bank,2025-03-01,2025-10-01
the belgaum industrial cooperative bank,2024-04-01,2025-10-01
the bellary dist cooperative central bank limited,2024-04-01,2025-10-01
the bellary district cooperative central bank limited,2024-04-01,2025-10-01
the bengaluru district central cooperative bank limited,2025-07-01,2025-10-01
the bengaluru district central cooperative bank limited bengaluru,2024-12-01,2025-10-01
the berhampore cooperative central bank limited,2024-04-01,2025-10-01
the berhampore cooperative central bank limited berhampore,2024-04-01,2025-10-01
the berhampur cooperative urban bank limited,2024-04-01,2025-10-01
the bhabhar vibhag nagrik sahakari bank limited,2024-04-01,2025-10-01
the bhadgaon peoples cooperative bank limited,2024-04-01,2025-10-01
the bhadran peoples cooperative bank limited bhadran,2024-04-01,2025-10-01
the bhagalpur central cooperative bank limited,2024-04-01,2025-10-01
the bhagalpur central coopertative bank,2024-04-01,2025-10-01
the bhagyalakshmi mahila sahakari bank limited,2024-04-01,2025-10-01
the bhagyalakshmi mahila sahakari bank limited hdfc bank,2024-04-01,2025-10-01
the bhagyalakshmi mahila sahakari bank limited nanded,2024-04-01,2025-10-01
the bhagyoday cooperative bank limited,2024-04-01,2025-10-01
the bhagyodaya cooperative bank limited,2024-04-01,2025-10-01
the bhandara dist central cooperative bank limited,2024-04-01,2025-10-01
the bhandara urban cooperative bank limited,2024-04-01,2025-10-01
the bharat cooperative bank limited,2024-04-01,2025-10-01
the bharat cooperative bank mumbai limited,2024-04-01,2025-10-01
the bharath cooperative bank limited,2024-04-01,2025-10-01
the bharatpur central cooperative bank bharatpur,2024-04-01,2024-11-01
the bharatpur central cooperative bank limited,2024-04-01,2025-10-01
the bharatpur urban cooperative bank limited,2024-04-01,2025-10-01
the bharuch district central cooperative bank limited,2024-04-01,2025-10-01
the bhatkal urban cooperative bank limited,2024-04-01,2025-10-01
the bhatkal urban cooperative bank limited bhatkal,2024-04-01,2025-10-01
the bhavana rishi cooperative bank limited,2024-04-01,2025-10-01
the bhavana rishi cooperative urban bank limited,2024-04-01,2025-10-01
the bhavasara kshatriya cooperative bank limited,2024-04-01,2025-10-01
the bhavnagar dccb,2024-04-01,2025-10-01
the bhawanipatna central cooperative bank limited,2024-04-01,2025-10-01
the bhiwani central cooperative bank limited,2024-04-01,2025-10-01
the bhiwani central cooperative bank limited bhiwani,2024-04-01,2025-10-01
the bhuj commercial cooperative bank limited,2024-04-01,2025-10-01
the bhuj commerical cooperative bank limited,2024-04-01,2025-10-01
the bhuj mercantile cooperative bank limited,2024-04-01,2025-10-01
the bhuj mercentile cooperative bank limited,2024-04-01,2025-10-01
the bhupathi raju cooperative credit bank limited,2024-04-01,2025-10-01
the bicholim urban cooperative bank limited,2024-04-01,2025-10-01
the bihar awami cooperative bank limited,2024-04-01,2025-10-01
the bihar state cooperative bank limited,2024-04-01,2025-10-01
the bijapur mahalaxmi urban cooperative bank,2024-04-01,2025-10-01
the bijnor urban cooperative bank limited,2024-04-01,2025-10-01
the bishnupur town cooperative bank limited,2024-04-01,2025-10-01
the bodeli urban cooperative bank limited bodeli,2024-04-01,2025-10-01
the bolangir district central cooperative bank limited,2024-04-01,2025-10-01
the bolangir district central cooperative bank limited bolangir,2024-04-01,2025-09-01
the boral union cooperative bank limited,2024-04-01,2025-10-01
the boudh cooperative central bank limited,2024-04-01,2025-10-01
the boudh cooperative central bank limited boudh,2024-04-01,2025-09-01
the buldana district central cooperative bank limited buldan,2024-05-01,2025-10-01
the buldhana district central cooperative bank limited buldhana,2024-04-01,2025-09-01
the bundi central cooperative bank limited,2024-04-01,2025-10-01
the bundi urban cooperative bank limited,2024-04-01,2025-10-01
the burdwan central cooperative bank limited,2024-04-01,2025-10-01
the business cooperative bank limited,2024-04-01,2025-10-01
the calicut cooperative urban bank limited,2024-04-01,2025-10-01
the cardamom merchants cooperative bank limited,2024-04-01,2025-10-01
the cardamom merchants cooperative bank limited haveri,2025-06-01,2025-10-01
the catholic cooperative urban bank limited,2024-04-01,2025-09-01
the central cooperative bank limited,2024-04-01,2025-10-01
the central cooperative bank limited bhilwara,2024-04-01,2025-10-01
the central cooperative bank limited bikaner,2024-04-01,2025-10-01
the central cooperative bank limited tonk,2024-04-01,2024-05-01
the chamba urban cooperative bank limited,2024-04-01,2025-10-01
the chanasma commercial cooperative bank limited,2024-04-01,2025-10-01
the chanasma nagrik sahakari bank limited,2024-04-01,2025-10-01
the chandgad urban cooperative bank limited,2024-04-01,2025-10-01
the chandigarh state cooperative bank limited,2024-04-01,2025-10-01
the chandrapur dccb limited,2024-11-01,2025-10-01
the chandrapur district central cooperative bank limited,2024-04-01,2025-10-01
the chandwad merchants cooperative bank limited,2024-04-01,2025-10-01
the changanacherry cooperative urban bank limited,2024-04-01,2025-10-01
the charada nagarik sahakari bank limited charada,2024-04-01,2025-10-01
the chembur nagarik sahakari bank limited,2024-04-01,2025-10-01
the chembur nagrik sahakari bank limited,2024-04-01,2025-10-01
the chennai central cooperative bank limited,2024-04-01,2025-10-01
the cherplacheri urban cooperative bank limited,2024-04-01,2025-10-01
the chhapi nagrik sahakari bank limited,2024-11-01,2025-10-01
the chhapi nagrik sahakri bank limited,2024-04-01,2025-10-01
the chikhli urban cooperative bank limited,2024-04-01,2025-10-01
the chikmagalur district cooperative central bank limited,2024-04-01,2025-10-01
the chiplun urban cooperative bank limited,2024-04-01,2025-10-01
the chiplun urban cooperative bank limited chiplun,2024-04-01,2025-10-01
the chitnavispura sahakari bank limited,2024-04-01,2025-10-01
the chitnavispura sahakari bank limited nagpur,2024-04-01,2025-09-01
the chitoor district cooperative central bank limited,2024-04-01,2025-10-01
the chitradurga district cooperative central bank,2024-04-01,2025-10-01
the chitradurga district cooperative central bank limited chitradurga,2024-04-01,2025-09-01
the chittoor district cooperative central bank limited,2024-04-01,2025-10-01
the chittorgarh kendriya sahakari bank limited,2024-04-01,2025-10-01
the chopda people s cooperative bank limited,2024-04-01,2025-10-01
the chopda peoples cooperative bank limited chopda,2024-04-01,2025-10-01
the churu central cooperative bank limited,2024-04-01,2025-10-01
the churu central cooperative bank limited churu,2024-04-01,2025-10-01
the citizens cooperative bank limited,2024-04-01,2025-10-01
the citizens cooperative bank limited jammu,2024-04-01,2025-10-01
the citizens urban cooperative bank limited,2024-04-01,2025-10-01
the coastal urban cooperative bank limited,2024-04-01,2025-10-01
the coastal urban cooperative bank limited kollam,2025-03-01,2025-10-01
the coastal urban cooperative bank limited no 3036,2024-04-01,2025-09-01
the coimbatore city cooperative bank limited,2024-04-01,2025-10-01
the coimbatore dist central cooperative bank limited,2024-04-01,2025-10-01
the coimbatore district central cooperative bank limited,2024-04-01,2025-10-01
the commercial cooperative bank limited,2024-04-01,2025-10-01
the commercial cooperative bank limited kolhapur,2024-04-01,2025-10-01
the comptrollers office cooperative bank limited,2025-03-01,2025-09-01
the cooperative bank of mehsana limited,2024-04-01,2025-10-01
the cooperative bank of rajkot limited,2024-04-01,2025-10-01
the cooperative bank of rajkot naranpura,2024-04-01,2025-10-01
the cooperative city bank limited,2024-04-01,2025-10-01
the cooperative urban bank limited kottarakara,2024-04-01,2025-10-01
the cosmos cooperative bank limited,2024-04-01,2025-10-01
the cuddalore district central cooperative bank limited,2024-04-01,2025-10-01
the dahod mercantile cooperative bank limited,2024-04-01,2025-10-01
the dahod urban cooperative bank limited,2024-04-01,2025-10-01
the dakshin dinajpur district central cooperative bank limited,2024-04-01,2025-10-01
the daman diu state cooperative bank limited,2025-04-01,2025-10-01
the darussalam cooperative urban bank limited,2024-04-01,2025-10-01
the dausa kendriya sahakari bank limited,2024-04-01,2025-10-01
the davangere harihar urban sahakara bank niyamith,2024-04-01,2025-10-01
the davangere harihar urban sahakara bank niyamitha,2024-04-01,2025-10-01
the davangere urban cooperative bank limited,2024-04-01,2025-10-01
the deccan cooperative urban bank limited,2024-04-01,2025-10-01
the deccan merchants cooperative bank limited,2024-04-01,2025-09-01
the deola merchant cooperative bank,2024-04-01,2025-10-01
the deola merchant s cooperative bank limited deola,2024-04-01,2025-09-01
the devgad urban cooperative bank limited,2024-04-01,2025-10-01
the dhanbad central cooperative bank limited,2024-04-01,2025-10-01
the dhanera mercantile cooperative bank limited,2024-04-01,2025-10-01
the dharmaj peoples cooperative bank limited,2024-04-01,2025-10-01
the dharmapuri district central cooperative bank limited micro atm,2025-10-01,2025-10-01
the dharmavaram cooperative town bank limited,2024-04-01,2025-10-01
the dhinoj nagrik sahakari bank limited,2024-05-01,2025-08-01
the dholpur urban cooperative bank limited,2024-04-01,2025-10-01
the dholpur urban cooperative bank limited dholpur,2024-04-01,2025-10-01
