Bank,First_Active_Month,Last_Active_Month
the dhrangadhra peoples cooperative bank limited,2024-04-01,2025-10-01
the dhule and nandurbar district central cooperative bank,2024-04-01,2025-10-01
the dhule nandurbar district central cooperative bank limited dhule,2024-04-01,2025-10-01
the dindigul central cooperative bank limited,2024-04-01,2025-10-01
the dindigul urban cooperative bank limited,2024-04-01,2025-10-01
the dist cooperative central bank mahabubnagar,2024-04-01,2025-10-01
the district central coopearative bank limited khammam,2024-04-01,2025-10-01
the district central cooperative bank limited khammam,2024-04-01,2025-10-01
the district cooperative bank limited lucnow,2024-04-01,2025-10-01
the district cooperative central bank limited,2024-04-01,2025-10-01
the district cooperative central bank limited bidar,2024-04-01,2025-10-01
the district cooperative central bank limited eluru,2024-04-01,2025-10-01
the district cooperative central bank limited kakinada,2024-04-01,2025-10-01
the district cooperative central bank limited kurnool,2024-04-01,2025-10-01
the district cooperative central bank limited medak,2024-04-01,2025-10-01
the district cooperative central bank limited srikakulam,2024-04-01,2025-10-01
the district cooperative central bank limited visakhapatnam,2024-04-01,2025-10-01
the district cooperative central bank limited vizianagaram,2024-04-01,2025-10-01
the district cooperative central bank mahabubnagar,2024-04-01,2025-10-01
the dungarpur central cooperative bank limited,2024-04-01,2025-10-01
the eastern railway employees cooperative bank limited,2024-04-01,2025-10-01
the eenadu cooperative urban bank limited,2024-04-01,2025-10-01
the eluri cooperative urban bank limited,2024-04-01,2025-10-01
the eluru cooperative urban bank limited,2024-04-01,2025-10-01
the erode dist central cooperative bank limited,2024-04-01,2025-10-01
the erode district central cooperative bank limited,2024-04-01,2025-10-01
the erode district central cooperative bank limited micro atm,2025-10-01,2025-10-01
the excellent cooperative bank limited,2024-04-01,2025-10-01
the faridabad central cooperative bank limited,2024-04-01,2025-10-01
the faridabad central cooperative bank limited faridabad,2024-04-01,2025-10-01
the faridkot central cooperative bank limited,2024-04-01,2025-10-01
the farrukhabad district cooperative bank limited,2024-04-01,2025-10-01
the farrukhabad district cooperative bank limited fatehgarh,2024-04-01,2025-10-01
the fatehabad central cooperative bank limited,2024-04-01,2025-10-01
the fatehabad central cooperative bank limited fatehabad,2024-04-01,2025-10-01
the fatehgarh sahib central cooperative bank limited,2024-04-01,2025-10-01
the fatehgarh sahib central cooperative bank limited sirhind,2024-04-01,2025-10-01
the fazilka central cooperative bank limited,2024-04-01,2025-10-01
the fazilka central cooperative bank limited abohar,2024-04-01,2025-10-01
the federal bank limited,2024-04-01,2025-10-01
the feroke cooperative urban bank limited,2024-04-01,2025-10-01
the ferozepur central cooperative bank limited,2024-04-01,2025-10-01
the ferozepur central cooperative bank limited ferozepur,2024-04-01,2025-10-01
the financial cooperative bank limited,2024-04-01,2025-10-01
the gadchiroli district central cooperative bank limited,2024-04-01,2025-10-01
the gadchiroli nagari sahakari bank limited gadch,2024-04-01,2025-10-01
the gadhinglaj urban cooperative bank limited gadhinglaj,2024-04-01,2025-10-01
the gandevi people cooperative bank,2024-04-01,2025-10-01
the gandevi people s cooperative bank limited,2024-04-01,2025-10-01
the gandhi cooperative urban bank limited,2024-04-01,2025-10-01
the gandhi gunj cooperative bank limited,2024-04-01,2025-10-01
the gandhidham cooperative bank limited,2024-04-01,2025-10-01
the gandhidham mercantile cooperative bank limited,2024-04-01,2025-10-01
the gandhinagar nagarik cooperative bank limited,2024-04-01,2025-10-01
the gandhinagar nagrik cooperative bank limited,2024-04-01,2025-10-01
the gandhinagar urban cooperative bank limited,2024-04-01,2025-10-01
the ganga mercantile urban cooperative bank limited,2024-04-01,2025-10-01
the ganganagar kendriya sahakari bank limited,2024-04-01,2025-10-01
the gauhati cooperative bank,2024-04-01,2025-10-01
the gayatri cooperative urban bank limited,2024-04-01,2025-10-01
the ghatal peoples cooperative bank limited,2024-04-01,2025-10-01
the ghoghamba vibhag nagrik sahakari bank limited,2024-04-01,2025-10-01
the ghoti merchants cooperative bank limited ghoti,2024-04-01,2025-10-01
the goa state cooperative bank limited,2024-04-01,2025-10-01
the goa urban cooperative bank limited,2024-04-01,2025-10-01
the godhra city cooperative bank limited,2024-05-01,2025-09-01
the godhra city cooperative bank limited godhra,2024-04-01,2025-10-01
the godhra urban cooperative bank limited,2024-04-01,2025-10-01
the gokak urban cooperative credit bank limited,2024-04-01,2025-10-01
the gokarananath cooperative bank limited,2024-04-01,2025-10-01
the gondia district central cooperative bank limited,2024-04-01,2025-10-01
the gooty coperative town bank limited,2024-11-01,2025-10-01
the gopalganj central cooperative bank limited,2024-04-01,2025-10-01
the gopalganj central cooperativeertative bank limited,2024-04-01,2025-10-01
the gozaria nagrik sahakari bank limited,2024-04-01,2025-10-01
the graduates cooperative bank limited,2024-04-01,2025-10-01
the grain merchant s cooperative bank limited,2024-04-01,2025-10-01
the greater bombay cooperative bank limited,2024-04-01,2025-10-01
the guardian souharda sahakari bank niyamita,2024-04-01,2025-10-01
the gudivada cooperative urban bank limited,2024-04-01,2025-10-01
the gudiyattam cooperative urban bank,2024-04-01,2025-10-01
the gujarat state cooperative bank limited,2024-04-01,2025-10-01
the gujarat state cooperative bankltd,2024-04-01,2025-10-01
the guntur cooperative urban bank limited,2024-04-01,2025-10-01
the guntur district cooperative central bank limited,2024-04-01,2025-10-01
the gurdaspur central cooperative bank limited,2024-04-01,2025-10-01
the gurgaon central cooperative bank limited,2024-04-01,2025-10-01
the guruvayur cooperative urban bank limited,2024-04-01,2025-10-01
the halol mercantile cooperative bank limited,2024-04-01,2025-10-01
the halol urban cooperative bank limited,2024-04-01,2025-10-01
the hansot nagarik sahakari bank limited,2024-04-01,2025-10-01
the hanumangarh kendriya sahakari bank limited,2024-04-01,2025-10-01
the hanumanthanagar cooperative bank limited,2024-04-01,2025-03-01
the harij nagarik sahakari bank limited harij,2024-04-01,2025-10-01
the haryana state cooperative apex bank limited,2024-04-01,2025-10-01
the hassan district cooperative central bank limited,2024-04-01,2025-10-01
the hasti cooperative bank limited,2024-04-01,2025-10-01
the haveri urban cooperative bank limited,2024-04-01,2025-10-01
the himachal pradesh gramin bank,2024-04-01,2025-10-01
the himachal pradesh state cooperative bank limited,2024-04-01,2025-10-01
the hindustan cooperative bank limited,2024-04-01,2025-10-01
the hindustan shipyard staff cooperative bank limited,2024-04-01,2025-10-01
the hindusthan cooperative bank limited,2024-04-01,2025-10-01
the hisar central cooperative bank limited hisar,2024-04-01,2025-10-01
the hisar urban cooperative bank limited,2024-04-01,2025-10-01
the honavar urban cooperative bank limited,2024-04-01,2025-10-01
the hongkong and shanghai banking corporation,2024-06-01,2024-06-01
the hongkong and shanghai banking corporation limi,2024-04-01,2025-10-01
the hooghly cooperative credit bank limited,2024-04-01,2025-10-01
the hoshiapur central cooperative bank limited,2024-04-01,2025-10-01
the hoshiarpur central cooperative bank limited,2024-04-01,2025-10-01
the hospet cooperative city bank limited,2024-04-01,2025-10-01
the hotel industrialists cooperative bank limited,2024-04-01,2025-09-01
the hotel industrialists cooperative bank limited bangalore,2024-04-01,2025-10-01
the howrah district central cooperative bank limited,2024-04-01,2025-10-01
the hukkeri urban cooperative bank limited,2024-04-01,2025-10-01
the hyd dist central cooperative bank limited,2024-04-01,2025-10-01
the hyderabad district cooperative bank limited,2024-09-01,2025-10-01
the hyderabad district cooperative bank limited hdd,2025-01-01,2025-10-01
the hyderabad district cooperative central bank hyderabad,2024-04-01,2025-10-01
the ichalkaranji merchants cooperative bank limited,2024-04-01,2025-10-01
the ichalkaranji merchants cooperative bank limited ichalkaranji,2024-04-01,2025-10-01
the idar nagarik sahakari bank limited,2024-04-01,2025-10-01
the idar nagrik sahakari bank limited,2024-04-01,2025-10-01
the ilkal cooperative bank limited,2024-04-01,2025-10-01
the imphal urban cooperative bank limited,2024-04-01,2025-10-01
the imphal urban cooperativeeerative bank limited,2024-04-01,2025-10-01
the income tax dept cooperative bank,2024-04-01,2025-09-01
the income tax dept cooperative bank limited mumbai,2024-04-01,2025-10-01
the industrial cooperative bank limited,2024-04-01,2025-07-01
the innespeta cooperative urban bank limited,2024-04-01,2025-10-01
the islampur urban cooperative bank limited,2024-04-01,2025-10-01
the j k state cooperative bank limited,2024-04-01,2025-10-01
the jagruti cooperative bank limited,2024-04-01,2025-10-01
the jain sahakari bank limited,2024-04-01,2025-10-01
the jaipur central cooperative bank limited,2024-04-01,2025-10-01
the jaisalmer central coopertiave bank limited,2024-04-01,2025-10-01
the jalandhar central cooperative bank limited,2024-04-01,2025-10-01
the jalgaon district central cooperative bank limited,2024-04-01,2025-10-01
the jalgaon district central cooperative bank limited jalgaon,2024-04-01,2025-10-01
the jalgaon peoples cooperative bank limited,2024-04-01,2025-10-01
the jalna district central cooperative bank limited,2024-04-01,2025-10-01
the jalna peoples cooperative bank limited,2024-04-01,2025-10-01
the jalore central cooperative bank limited jalore,2024-04-01,2025-03-01
the jalore nagrik sahakari bank limited,2024-04-01,2025-10-01
the jalpaiguri central cooperative bank limited,2024-04-01,2025-10-01
the jambusar peoples cooperative bank limited,2024-04-01,2025-10-01
the jamkhandi urban cooperative bank limited,2024-04-01,2025-10-01
the jammu and kashmir bank limited,2024-04-01,2025-10-01
the jammu and kashmir state cooperative bank limited,2024-04-01,2025-10-01
the jamnagar district cooperative bank limited,2024-04-01,2025-10-01
the jamnagar mahila sahakari bank,2024-04-01,2025-10-01
the jampeta cooperative urban bank limited,2024-04-01,2025-10-01
the janata cooperative bank limited,2024-04-01,2025-10-01
the janata cooperative bank limited godhra,2024-04-01,2025-10-01
the janata cooperative bank limited jcb,2024-04-01,2025-10-01
the janata sahakari bank limited yeola,2024-04-01,2025-10-01
the janatha cooperative bank limited,2024-04-01,2025-09-01
the jawhar urban cooperative bank limited,2024-04-01,2025-10-01
the jhajjar central cooperative bank limited,2024-04-01,2025-10-01
the jhalod urban cooperative bank limited,2024-04-01,2025-10-01
the jharkhand state cooperative bank limited,2024-04-01,2025-10-01
the jind central cooperative bank limited,2024-04-01,2025-10-01
the jodhpur central cooperative bank limited,2024-04-01,2025-10-01
the jodhpur central cooperative bank limited jodhpur,2024-04-01,2025-09-01
the jowai cooperative urban bank limited,2024-04-01,2025-10-01
the jullundur central cooperative bank limited,2024-04-01,2025-10-01
the junagadh commercial cooperative bank limited,2024-04-01,2025-10-01
the junagadh jilla sahakari bank limited,2024-04-01,2025-10-01
the junagarh jilla shakari bank limited,2024-04-01,2025-10-01
the kachchh district central cooperative bank limited,2024-04-01,2025-10-01
the kadapa dist cooperative central bank kadapa,2024-04-01,2025-10-01
the kadappa district cooperative central bank limited,2025-05-01,2025-10-01
the kaduthuruthy urban cooperative bank limited,2024-04-01,2025-10-01
the kaduthuruthy urban cooperative bank limited k 399,2024-04-01,2025-09-01
the kagal cooperative bank limited,2024-04-01,2025-10-01
the kaira dccb,2024-04-01,2025-10-01
the kaira district central cooperative bank limited,2024-04-01,2025-10-01
the kaira district cooperative bank limited,2024-04-01,2025-10-01
the kaithal central cooperative bank limited,2024-04-01,2025-10-01
the kakatiya cooperative urban bank limited,2024-04-01,2025-10-01
the kakinada cooperative town bank limited,2024-04-01,2025-10-01
the kakinada cooperative town bank limited no c 750,2024-04-01,2025-10-01
the kalna town credit cooperative bank limited,2024-04-01,2025-10-01
the kalol nagarik sahakari bank limited,2024-04-01,2025-10-01
the kalupur commercial cooperative bank limited,2024-04-01,2025-10-01
the kalwan merchants cooperative bank limited kalwan,2024-04-01,2025-10-01
the kalyan cooperative bank limited,2024-04-01,2025-10-01
the kalyan janata sahakari bank limited,2024-04-01,2025-10-01
the kanakamahalakshmi cooperative bank limited,2024-04-01,2025-10-01
the kanakmahalakshmi cooperative bank,2024-04-01,2025-10-01
the kanara dccb limited sirsi,2024-04-01,2025-10-01
the kanara district central cooperative bank limited,2024-04-01,2025-10-01
the kancheepuram central cooperative bank limited,2024-04-01,2025-10-01
the kangra central cooperative bank limited,2024-04-01,2025-10-01
the kangra cooperative bank limited,2024-04-01,2025-10-01
the kannur cooperative urban bank limited,2024-04-01,2025-10-01
the kanyakumari district central cooperative bank limited,2024-04-01,2025-10-01
the kanyakumari district central cooperative bank limited micro atm,2025-10-01,2025-10-01
the kapadwanj peoples cooperative bank limited kapadwanj,2024-04-01,2025-10-01
the kapurthala central cooperative bank limited,2024-04-01,2025-10-01
the kapurthala central cooperative bank limited kapurthala,2024-04-01,2025-10-01
the karad urban cooperative bank limited,2024-04-01,2025-10-01
the karim nagar cooperative urban bank limited,2024-04-01,2025-10-01
the karimnagar dist cooperative central limited,2024-04-01,2025-10-01
the karimnagar district cooperative central bank limited,2024-04-01,2025-10-01
the karimnagar district cooperative ctral bank,2024-04-01,2025-10-01
the karjan nagrik sahakari bank limited karjan,2024-04-01,2025-10-01
the karnal central cooperative bank limited,2024-04-01,2025-10-01
the karnal central cooperative bank limited karnal,2024-04-01,2025-10-01
the karnataka central cooperative bank limited dharwad,2024-04-01,2025-10-01
the karnataka state cooperative apex bank limited,2024-04-01,2025-10-01
the karnavati cooperative bank limited,2024-04-01,2025-10-01
the karunagappally taluk urban cooperative bank limited,2024-04-01,2025-09-01
the karur vysya bank limited,2024-04-01,2025-10-01
the kasaragod cooperative town bank limited no 970,2024-04-01,2025-10-01
the kasargod cooperative town bank limited,2024-04-01,2025-10-01
the katihar district central cooperative bank limited,2024-04-01,2025-09-01
the kattappana urban cooperative bank limited,2024-04-01,2025-10-01
the kendrapara urban cooperative bank limited,2024-04-01,2025-10-01
the kendrapara urban cooperative bank limiteda,2024-04-01,2025-09-01
the keonjhar central cooperative bank limited,2024-04-01,2025-10-01
the kerala state cooperative bank limited,2024-04-01,2025-10-01
the keshav sehkari bank limited,2024-04-01,2025-10-01
the khagaria district central cooperative bank limited,2024-04-01,2025-10-01
the khambhat nagarik sahakari bank limited,2024-04-01,2025-10-01
the khamgaon urban cooperative bank limited,2024-04-01,2025-10-01
the khamgaon urban cooperative bank limited khamgaon,2024-04-01,2025-10-01
the khanapur cooperative bank limited,2024-04-01,2025-10-01
the khattri cooperative urban bank limited,2024-04-01,2025-10-01
the kheda peoples cooperative bank limited,2024-04-01,2025-10-01
the kheda peoples cooperative bank limited kheda,2024-04-01,2025-09-01
the kheralu nagarik sahakari bank limited,2024-04-01,2025-10-01
the khordha central cooperative bank limited,2024-04-01,2025-10-01
the khurda central cooperative bank limited,2024-04-01,2025-10-01
the khurda central cooperative bank limited khordha,2024-04-01,2025-10-01
the kodagu district cooperative central bank limited,2024-04-01,2025-10-01
the kodinar nagarik sahakari bank limited,2024-04-01,2025-10-01
the kodinar nagrik sahakari bank limited,2024-04-01,2025-09-01
the kodinar taluka cooperative banking union limited,2024-04-01,2025-10-01
the kodoli urban cooperative bank limited,2024-04-01,2025-10-01
the kodoli urban cooperative bank limited kodoli,2025-02-01,2025-09-01
the kodungallur town cooperative bank limited,2024-04-01,2025-10-01
the kolar and chickballapur dt cooperative central bank,2025-09-01,2025-10-01
the kolar and chikballapura dist cooperative centr,2024-04-01,2025-10-01
the kolhapur urban cooperative bank limited,2024-04-01,2025-10-01
the konark urban cooperative bank limited,2024-04-01,2024-04-01
the kopargaon people s cooperative bank limited,2024-04-01,2025-10-01
the koraput central cooperative bank limited,2024-04-01,2025-10-01
the kosamba mercantile cooperative bank limited,2024-04-01,2025-10-01
the kota central cooperative bank limited,2024-04-01,2025-10-01
the kota central cooperative bank limited kota,2024-04-01,2024-11-01
the kottakkal cooperative urban bank limited,2024-04-01,2025-10-01
the kottarakara cooperative urban bank limited no 1909,2024-04-01,2025-10-01
the koylanchal urban cooperative bank limited,2024-04-01,2025-10-01
the kranthi cooperative urban bank limited,2024-04-01,2025-10-01
the krishna dist cooperative central bank limited,2024-04-01,2025-10-01
the krishna district cooperative bank,2024-05-01,2025-10-01
the krishna district cooperative central bank limited machilipatnam,2024-04-01,2025-10-01
the krishnagar city cooperative bank limited,2024-04-01,2025-10-01
the kukarwada nagarik sahakari bank limited,2024-04-01,2025-10-01
the kumbakonam central cooperative bank limited,2024-04-01,2025-10-01
the kumbakonam central cooperative bank limited kumbakonam,2024-04-01,2025-10-01
the kumbakonam cooperative urban bank limited,2024-04-01,2025-10-01
the kumta urban cooperative bank limited,2024-04-01,2025-10-01
the kunbi sahakari bank limited,2024-04-01,2025-09-01
the kurmanchal nagar sahakari bank limited,2024-04-01,2025-10-01
the kurukshetra central cooperative bank limited,2024-04-01,2025-10-01
the lasalgaon merchants cooperative bank limited,2024-05-01,2025-09-01
the lasalgaon merchants cooperative bank limited lasalgaon,2024-04-01,2025-10-01
the latur district central cooperative bank limited,2024-05-01,2025-10-01
the latur district central cooperative bank limited latur,2024-04-01,2025-10-01
the latur urban cooperative bank limited latur,2024-04-01,2025-10-01
the laxmi urban cooperative bank limited,2024-04-01,2025-10-01
the laxmi urban cooperative bank limited gajendragad,2024-04-01,2025-10-01
the limbasi urban cooperative bank limited,2024-04-01,2025-10-01
the limdi urban cooperative bank limited limdi,2024-04-01,2025-10-01
the ludhiana central cooperative bank limited,2024-04-01,2025-10-01
the lunawada nagarik sahakari bank limited,2024-04-01,2025-10-01
the lunawada nagrik sahakari bank limited lunawada,2024-04-01,2025-10-01
the lunawada peoples cooperative bank limited,2024-04-01,2025-10-01
the lunawada peoples cooperative bank limited lunawada,2024-04-01,2025-10-01
the lunawada peoples s cooperative bank limited,2024-04-01,2025-09-01
the madanapalle cooperative town bank limited,2024-04-01,2025-10-01
the madurai district central cooperative bank limited,2024-04-01,2025-10-01
the madurai district central cooperative bank limited micro atm,2025-10-01,2025-10-01
the magadh central cooperative bank limited,2024-04-01,2025-10-01
the magadh central cooperative bank limited gaya,2024-04-01,2025-10-01
the mahabaleshwar urban cooperative bank limited,2024-04-01,2025-10-01
the mahabaleshwar urban cooperative bank limited mahabaleshwar,2025-05-01,2025-10-01
the mahalingpur urban cooperative bank limited,2025-06-01,2025-09-01
the mahanagar cooperative bank limited,2024-04-01,2025-10-01
the mahanagar cooperative urban bank limited,2024-04-01,2025-10-01
the maharaja cooperative urban bank limited,2024-04-01,2025-10-01
the maharashtra mantralaya allied offices cooperative bank limited mumbai,2024-04-01,2025-10-01
the maharashtra mantralaya and allied offices cooperative bank limited,2024-04-01,2025-10-01
the maharashtra state cooperative bank limited,2024-04-01,2025-10-01
the mahaveer cooperative bank limited,2024-04-01,2025-10-01
the mahaveer cooperative bank limited belagavi,2024-04-01,2025-10-01
the mahaveer cooperative bank limited karnataka,2024-04-01,2025-10-01
the mahendergarh central cooperative bank,2024-04-01,2025-10-01
the mahendragarh central cooperative bank limited,2024-04-01,2025-10-01
the mahesh urban cooperative bank limited parli,2024-04-01,2025-10-01
the mahila urban cooperative bank limited gondia,2024-04-01,2025-10-01
the mahila vikas cooperative bank limited ahmedabad,2025-02-01,2025-02-01
the mahudha nagarik sahakari bank limited mahudha,2024-04-01,2025-10-01
the makapura industrial estate cooperative bank limited,2024-04-01,2025-10-01
the makarpura industrial estate cooperative bank limited,2024-04-01,2025-10-01
the malad sahakari bank limited,2024-04-01,2025-10-01
the malappuram district cooperative bank limited,2024-04-01,2025-10-01
the malegaon merchants cooperative bank limited,2024-04-01,2025-10-01
the malegaon merchants cooperative bank limited malegaon,2025-07-01,2025-10-01
the mallapur urban cooperative bank limited,2024-04-01,2025-10-01
the malleswaram cooperative bank limited,2024-04-01,2025-10-01
the malpur nagrik sahakari bank limited,2024-04-01,2025-10-01
the mandal nagarik sahakari bank limited,2024-04-01,2025-10-01
the mandi urban cooperative bank limited mandi,2024-04-01,2025-10-01
the mandvi mercantile cooperative bank limited,2024-04-01,2025-10-01
the mandvi nagarik sahakari bank limited,2024-04-01,2025-10-01
the mandvi nagrik sahakari bank limited,2024-04-01,2025-10-01
the mangaldai nagar sambai bank limited,2024-04-01,2025-10-01
the mangalore catholic cooperative bank limited,2024-04-01,2025-10-01
the mangalore cooperative town bank limited,2024-04-01,2025-10-01
the manipur state cooperative bank limited,2024-04-01,2025-10-01
the manipur state cooperative bank limited imphal,2024-04-01,2025-10-01
the manipur womens cooperative bank limited,2024-04-01,2025-10-01
the manjeri cooperative urban bank limited,2024-04-01,2025-10-01
the mansa central cooperative bank limited,2024-04-01,2025-10-01
the mansa nagarik sahakari bank limited,2024-04-01,2025-10-01
the maratha cooperative bank limited karnataka,2024-04-01,2025-10-01
the mattancherry mahajanik cooperative urban bank,2024-04-01,2025-10-01
the mattancherry sarvajanik cooperative bank limited,2024-04-01,2025-10-01
the mattancherry sarvajanik cooperative bank limited no 3284,2024-04-01,2025-10-01
the mayani urban cooperative bank limited,2024-04-01,2025-10-01
the mayani urban cooperative bank limited mayani,2024-04-01,2025-10-01
the mayubhanj central cooperative bank limited,2024-04-01,2025-10-01
the mayurbhanj central cooperative bank limited,2024-04-01,2025-10-01
the meenachil east urban cooperative bank limited,2024-04-01,2025-10-01
the meghalaya cooperative apex bank limited,2024-04-01,2025-10-01
the meghraj nagarik sahakari bank limited,2024-04-01,2025-10-01
the mehmadabad urban peoples cooperative bank limited,2024-04-01,2025-10-01
the mehsana district central cooperative bank limited,2024-04-01,2025-10-01
the mehsana district central cooperative bank limited mehsana,2024-04-01,2025-10-01
the mehsana jilla panchayat karmachari cooperative bank,2024-04-01,2025-10-01
the mehsana nagarik sahakari bank limited,2024-04-01,2025-10-01
the mehsana nagrik sahakari bank limited,2024-04-01,2025-09-01
the mehsana urban cooperative bank,2024-04-01,2025-10-01
the mercantile cooperative urban bank secunderabad limited,2025-03-01,2025-09-01
the merchants liberal cooperative bank limited,2024-04-01,2025-10-01
the merchants liberal cooperative bank limited gadag,2024-04-01,2025-10-01
the merchants souharda sahakara bank n,2024-04-01,2025-10-01
the merchants souharda sahakara bank ni chitadurga,2024-04-01,2025-10-01
the merchants souharda sahakara bank ni chitradurga,2024-04-01,2025-10-01
the merchants urban cooperative bank limited,2024-04-01,2025-10-01
the mettupalayam cooperative urban bank limited,2024-04-01,2025-10-01
the midnapore peoples cooperative bank limited,2024-04-01,2025-10-01
the mizoram cooperative apex bank limited,2024-04-01,2025-10-01
the modasa nagarik sahakari bank limited,2024-04-01,2025-10-01
the modasa nagrik sahakari bank limited,2024-04-01,2025-10-01
the model cooperative bank limited,2024-04-01,2025-10-01
the model cooperative urban bank limited,2024-04-01,2025-10-01
the modern cooperative bank limited chalisgaon,2024-04-01,2025-10-01
the moga central cooperative bank limited,2024-04-01,2025-10-01
the moga district central cooperative bank limited moga,2024-04-01,2025-10-01
the mogaveera cooperative bank limited,2024-04-01,2025-10-01
the moirang primary cooperative bank limited,2024-04-01,2025-10-01
the monghyr jamui central cooperative bank limited munger,2024-04-01,2025-10-01
the motihari central cooperative bank limited,2024-04-01,2025-10-01
the mudalagi cooperative bank limited,2024-04-01,2025-09-01
the mudalagi cooperative bank limited mudalagi,2024-04-01,2025-10-01
the mudalagi cooperative bank limited mudalagi tmm,2025-02-01,2025-10-01
the mugberia central cooperative bank limited,2024-04-01,2025-10-01
the muktsar central cooperative bank limited,2024-04-01,2025-10-01
the muktsar central cooperative bank limited muktsar,2024-04-01,2025-10-01
the mulgund urban souharda cooperative bank limited,2024-04-01,2025-10-01
the mumbai mahanagarpalika shikshan vibhag sahakari bank limited,2024-04-01,2025-10-01
the muncipal cooperative bank limited,2024-04-01,2025-10-01
