Bank,First_Active_Month,Last_Active_Month
nishigandha sahakri bank limited pandharpur,2024-04-01,2025-10-01
nkgsb cooperative bank limited,2024-04-01,2025-10-01
nkgsb cooperativet bank,2024-04-01,2025-10-01
noble cooperative bank limited,2024-04-01,2025-10-01
north east small finance bank limited,2024-04-01,2025-10-01
northen railway primary cooperative bank limited,2024-04-01,2025-09-01
northern railway multi state primary cooperative bank,2024-04-01,2025-10-01
northern railway primary cooperative bank,2024-04-01,2025-10-01
nutan nagarik sahakari bank limited,2024-04-01,2025-10-01
nutan nagrik sahakari bank limited,2024-04-01,2025-10-01
nyayamitra sahakari bank niyamita,2024-04-01,2025-10-01
obopay mobile technology india pvt limited,2024-11-01,2025-10-01
odisha grameen bank,2025-10-01,2025-10-01
odisha gramya bank,2024-04-01,2025-10-01
om datta chaitanya sahakri bank limited wai,2024-04-01,2025-10-01
omerga janata sahakari bank limited omerga,2024-04-01,2025-10-01
omprakash deora peoples cooperative bank limited,2024-04-01,2025-10-01
omprakash deora peoples cooperative bank limited hingoli,2024-04-01,2025-10-01
one mobikwik systems limited,2024-04-01,2025-10-01
osmanabad jan sahakari bank,2024-04-01,2025-09-01
osmanabad janata sahakari bank limited,2024-04-01,2025-10-01
padmavathi cooperative urban bank limited,2024-04-01,2025-10-01
padra nagar nagrik sahakari bank limited padra,2024-04-01,2025-10-01
pala urban cooperative bank limited,2024-04-01,2025-10-01
palamoor cooperative urban bank limited,2024-04-01,2025-10-01
pali urban cooperative bank limited,2024-04-01,2025-10-01
palus sahakari bank limited,2024-04-01,2025-10-01
palus sahakari bank limited palus,2024-04-01,2025-10-01
panchsheel cooperative bank,2024-04-01,2025-10-01
panchsheel mer cooperative bank,2024-04-01,2025-10-01
pandharpur merchant cooperative bank,2024-04-01,2025-10-01
pandharpur urban cooperative bank limited,2024-04-01,2025-10-01
papanasam urban bank limited,2024-04-01,2025-10-01
parashwanath cooperative bank,2024-04-01,2025-10-01
paraspar sahakari bank,2024-04-01,2025-10-01
parner taluka sainik sahakari bank limited parner,2024-04-01,2025-10-01
parshwanath cooperative bank limited,2024-04-01,2025-10-01
paschim banga gramin bank,2024-04-01,2025-08-01
patan cooperative bank limited,2024-04-01,2025-10-01
patan nagarik sahakari bank limited,2024-04-01,2025-10-01
patan nagrik sahakari bank limited,2024-04-01,2025-09-01
patan urban cooperative bank limited,2024-04-01,2025-10-01
paul merchants finance private limited,2024-05-01,2025-10-01
pavana sahakari bank,2024-04-01,2025-10-01
pavana sahakari bank limited pune,2024-04-01,2025-10-01
paypoint india network private limited,2024-04-01,2025-10-01
paytm bank,2024-04-01,2025-10-01
people s cooperative bank limited dholka,2024-04-01,2025-10-01
people s urban cooperative bank limited,2024-04-01,2025-10-01
peoples cooperative bank limited hingoli,2024-04-01,2025-10-01
phonepe private limited,2024-04-01,2025-10-01
pilibhit district cooperative bank limited,2024-04-01,2025-10-01
pilibhit zila sahakari bank limited,2024-04-01,2025-10-01
pimpri chinchwad sahakari bank limited,2024-04-01,2025-10-01
pimpri chinchwad sahakari bank limited pimpri,2024-04-01,2025-10-01
pine labs private limited,2024-04-01,2025-10-01
pithoragarh zila sahakari bank limited,2024-04-01,2025-10-01
pittoragarh zila sahakari bank limited,2024-04-01,2025-10-01
pondy state cooperative bank,2024-04-01,2025-10-01
ponnampet town cooperative bank niyamitha,2024-04-01,2025-10-01
pooranwadi nagarik sahakari bank,2024-04-01,2025-10-01
poornawadi nagrik sahakari bank,2024-04-01,2025-10-01
poornawadi nagrik sahakari bank limited beed,2024-04-01,2025-10-01
poornawdi nagrik sahakari bank limited,2024-04-01,2025-10-01
porbandar commercial cooperative bank limited,2024-04-01,2025-10-01
porbandar vibhagiya nagarik sahakari bank limited,2024-04-01,2025-10-01
pragathi cooperative bank limited,2024-04-01,2025-09-01
pragathi krishna gramin bank,2024-04-01,2025-10-01
pragati mahila nagrik sahakari bank limited,2024-04-01,2025-10-01
pragati mahila nagrik sahakari bank limited bhilai,2024-04-01,2025-10-01
pragati sahakari bank limited,2024-04-01,2025-10-01
pragati sahakari bank vadodara,2024-04-01,2025-09-01
prathama up gramin bank,2024-04-01,2025-10-01
prathama up gramin bank erstwhile sarva up gramin bank,2024-04-01,2024-12-01
prathamik shikshak sahakari bank limited satara,2024-04-01,2025-10-01
prathma up gramin bank,2024-04-01,2025-09-01
prathma up gramin bank erstwhile sarva up gramin bank,2024-04-01,2025-09-01
pravara sahakari bank limited,2024-04-01,2025-10-01
premium ebusiness ventures private limited,2024-04-01,2025-09-01
prerana cooperative bank limited,2024-04-01,2025-10-01
prerana cooperative bank limited thergaon,2024-04-01,2025-10-01
prerna cooperative bank,2024-04-01,2025-10-01
prime cooperative bank limited,2024-04-01,2025-10-01
priyadarshani mahila nagari sahakari bank limited beed,2024-04-01,2025-10-01
priyadarshani nagari sahakari bank limited,2024-04-01,2025-10-01
priyadarshani nagari sahakari bank limited jalna,2024-04-01,2025-10-01
priyadarshani urban cooperative bank limited,2024-04-01,2025-10-01
priyadarshani urban cooperative bank limited kallam,2024-04-01,2025-10-01
priyadarshini mahila urban sahakari bank niyamitha,2024-04-01,2025-10-01
priyadarshini nagari sahakari bank,2024-04-01,2025-10-01
priyadarshini urban cooperative bank limited,2024-04-01,2025-10-01
progressive mercatile cooperative bank limited,2024-04-01,2025-10-01
pryadarshini urban cooperative bank limited kalamb,2024-04-01,2025-10-01
pudukottai district central cooperative bank limited,2024-04-01,2025-10-01
puduvai bharathiar grama bank,2024-04-01,2025-10-01
puduvai bharthier gramin bank,2024-04-01,2025-10-01
pune cantonment sahakari bank limited,2024-04-01,2025-10-01
pune cantontment sahakari bank limited,2024-04-01,2025-10-01
pune dccb,2024-04-01,2025-10-01
pune district central cooperative bank limited,2024-04-01,2025-10-01
pune district central cooperative bank limited pdcc,2024-04-01,2025-10-01
pune merchant cooperative bank limited,2024-04-01,2025-09-01
pune merchants cooperative bank limited,2024-04-01,2025-10-01
pune people s cooperative bank limited,2024-04-01,2025-10-01
pune peoples cooperative bank limited pune,2024-04-01,2025-10-01
pune urban cooperative bank limited,2024-04-01,2025-10-01
pune urban cooperative bank limited pune,2024-04-01,2025-10-01
punjab and sind bank,2024-04-01,2025-10-01
punjab gramin bank,2024-04-01,2025-10-01
punjab national bank,2024-04-01,2025-10-01
punjab national bank credit card,2024-04-01,2025-10-01
punjab national bank erstwhile oriental bank of commerce,2024-04-01,2024-04-01
purulia central cooperative bank limited,2024-04-01,2025-10-01
pusad urban cooperative bank limited,2024-04-01,2025-10-01
rahimatpur sahakari bank limited rahimatpur,2024-04-01,2025-10-01
raigad district central cooperative bank limited,2024-04-01,2025-10-01
raiganj central cooperative bank limited,2024-04-01,2025-10-01
raigarh nagrik sahakari bank limited raigarh,2024-04-01,2025-10-01
railway employees cooperative banking society limited,2024-04-01,2025-10-01
railway employees cooperative banking society limited jodhpur,2024-04-01,2025-10-01
railways cooperative bank,2024-04-01,2025-10-01
raipur urban mer cooperative bank,2024-04-01,2025-10-01
raipur urban merch co bank,2024-04-01,2025-10-01
raj rajeshwari mahila nagrik sahakari bank limited,2024-04-01,2025-10-01
rajadhani cooperative urban bank limited,2024-04-01,2025-10-01
rajalaxmi urban cooperative bank limited,2024-07-01,2025-10-01
rajapur urban cooperative bank limited,2024-04-01,2025-10-01
rajapur urban cooperative bank limited rajapur,2024-04-01,2025-10-01
rajarambapu sahakari bank limited,2024-04-01,2025-10-01
rajarambapu sahakari bank limited peth,2024-04-01,2025-10-01
rajarambapu sahakari bank limited peth ram,2024-07-01,2025-10-01
rajarshi shahu government servants bank limited,2024-04-01,2025-10-01
rajarshi shahu govt servants cooperative bank limited kolhap,2024-04-01,2025-10-01
rajarshi shahu sahakari bank limited,2024-04-01,2025-10-01
rajarshi shahu sahakari bank limited pune,2024-04-01,2025-10-01
rajashri sahu sahakari bank limited,2024-04-01,2025-10-01
rajasthan marudhara gramin bank,2024-04-01,2025-10-01
rajdhani nagar sahakari bank limited,2024-04-01,2025-10-01
raje vikramsinh ghatage cooperative bank limited kagal,2024-04-01,2025-10-01
raje vikramsinh ghatge cooperative bank limited kagal,2024-04-01,2025-10-01
rajgurunagar sahakari bank limited,2024-04-01,2025-10-01
rajgurunagar sahakari bank limited rsl,2024-06-01,2025-10-01
rajkot district central cooperative bank,2024-04-01,2025-10-01
rajkot district cooperative bank,2024-04-01,2025-10-01
rajkot nagarik sahakari bank limited,2024-04-01,2025-10-01
rajkot peoples cooperative bank limited,2024-04-01,2025-10-01
rajlaxmi urban cooperative bank limited,2024-04-01,2025-10-01
rajmata urban cooperative bank limited,2024-04-01,2025-10-01
rajpipla nagrik sahakari bank limited rajpipla,2024-04-01,2025-10-01
ramanagaram urban cooperative bank limited,2024-04-01,2025-10-01
rampur zila sahakari bank limited,2024-04-01,2025-10-01
rampur zila sahakari bank limited rampur,2024-04-01,2025-10-01
ramrajya sahakari bank limited,2024-04-01,2025-10-01
ranaghat peoples cooperative bank limited,2024-04-01,2025-10-01
rani channamma mahila sahakari bank,2024-04-01,2025-10-01
rani channamma mahila sahakari bank niyamit belagavi,2024-04-01,2025-10-01
rani laxmibai urban cooperative bank limited,2024-04-01,2025-10-01
raniganj cooperative bank limited,2024-04-01,2025-10-01
rapipay fintech private limited,2024-04-01,2025-10-01
ratanchand shaha sahakari bank limited,2024-04-01,2025-09-01
ratanchand shaha sahakari bank limited mangalwedha,2024-04-01,2025-10-01
ratnagiri dist central cooperative bank limited,2024-04-01,2025-10-01
ratnagiri district central cooperative bank limited,2024-04-01,2025-10-01
ratnagiri urban cooperative bank limited,2024-04-01,2025-10-01
ratnakar bank,2024-04-01,2025-10-01
rbl bank limited,2024-04-01,2025-10-01
rendal sahakari bank limited rendal,2024-04-01,2025-10-01
renuka nagrik sahakari bank limited ambikapur,2024-04-01,2025-10-01
reserve bank employees cooperative bank limited,2024-04-01,2025-10-01
reserve bank of india,2024-04-01,2025-10-01
royal monetary authority of bhutan,2024-04-01,2025-10-01
rukmini sahakari bank limited pandharpur,2024-04-01,2025-10-01
s s l s a kurundwad urban bank limited,2024-04-01,2025-10-01
s t cooperative bank limited,2024-04-01,2025-10-01
sadalga urban souharda sahakari bank niyamit,2024-04-01,2025-10-01
sadbhav nagarik sahakari bank mydt,2024-04-01,2025-10-01
sadguru gahininath urban cooperative bank limited,2024-04-01,2025-10-01
sadguru nagrik sahakari bank limited,2024-04-01,2025-10-01
sadhana sahakari bank limited,2024-04-01,2025-10-01
sadhana sahakari bank limited hadapsar,2025-07-01,2025-10-01
sadhana sahakari bank limited nagpur,2024-04-01,2025-10-01
sadhana sahakari bank limited yes bank,2024-04-01,2025-10-01
sadhana sahakari bank pune,2024-04-01,2025-10-01
sahakarmaharshi bhausaheb thorat amrutvahini sahakari bank limited,2024-11-01,2025-10-01
sahakarmaharshi bhausaheb thorat amrutvahinisahakari bank sts,2025-01-01,2025-10-01
sahyadri mahila urban cooperative bank limited,2024-04-01,2025-10-01
sahyadri sahakari bank limited,2024-04-01,2025-10-01
sahyog urban cooperative bank limited,2024-04-01,2025-10-01
sai baba nagari sahakari bank limited sailu,2024-04-01,2025-10-01
sai sanjivani cooperative bank limited kopargaon,2024-04-01,2025-10-01
saibaba janata sahakari bank limited latur,2025-01-01,2025-10-01
saibaba nagari sahakari bank,2024-04-01,2025-10-01
samarth sahakari bank limited jalna,2024-04-01,2025-10-01
samarth sahakari bank limited solapur,2024-04-01,2025-10-01
samarth urban cooperative bank limited osmanabad,2024-04-01,2025-10-01
samartha sahakari bank limited,2024-04-01,2025-10-01
samata cooperative development bank limited,2024-04-01,2025-10-01
samata sahakari bank limited,2024-04-01,2025-10-01
sambalpur central cooperative bank limited,2024-04-01,2025-10-01
sambalpur district cooperative central bank bargarh,2024-04-01,2025-09-01
sampada sahakari bank,2024-04-01,2025-10-01
sampada sahakari bank limited pune,2024-04-01,2025-10-01
samruddhi cooperative bank limited nagpur,2024-04-01,2025-10-01
samruddhi sahakari bank,2024-04-01,2025-10-01
samrudhi cooperative bank limited nagpur,2025-03-01,2025-10-01
samta sahakari bank limited dewas,2024-04-01,2025-10-01
sanawad nagrik sahakari bank limited sanawad,2024-04-01,2025-10-01
sandur pattana souharda sahakari bank,2024-04-01,2025-10-01
sandur pattana souharda sahakari bank ni,2024-04-01,2025-10-01
sandur pattana souharda sahakari bank niyamitha,2024-04-01,2025-10-01
sangli district central cooperative bank limited,2024-04-01,2025-10-01
sangli district central cooperative bank limited sangli,2024-04-01,2025-10-01
sangli district primary teachers cooperative bank limited sangli,2024-12-01,2025-09-01
sangli urban cooperative bank limited,2024-04-01,2025-10-01
sangli urban cooperative bank limited sangli,2024-04-01,2025-10-01
sangola urban cooperative bank limited,2024-04-01,2025-10-01
sankheda nagarik saha bank limited,2024-04-01,2025-10-01
sanmati sahakari bank limited,2024-04-01,2025-10-01
sanmitra mahila nagari sahakari bank,2024-04-01,2025-10-01
sanmitra mahila nagari sahakari bank limited chandrapur,2024-04-01,2025-10-01
sanmitra sahakari bank limited pune,2024-04-01,2025-10-01
sanmitra urban cooperative bank limited akola,2024-04-01,2025-10-01
sant sopankaka sahakari bank limited,2024-04-01,2025-10-01
sant sopankaka sahakari bank limited saswad,2024-04-01,2025-10-01
santragachi cooperative bank limited,2024-04-01,2025-10-01
saptagiri grameena bank,2024-04-01,2025-09-01
sarakari naukarara sahakari bank niyamat vijayapur,2024-04-01,2025-10-01
sarakari naukarara sahakari bank niyamit,2024-04-01,2025-10-01
sarakari naukarara sahakari bank niyamit vijayapura,2024-04-01,2025-10-01
saraspur nagarik cooperative bank limited,2024-04-01,2025-10-01
saraspur nagrik cooperative bank limited,2024-04-01,2025-10-01
saraspur nagrik sahaakri bank,2024-04-01,2025-10-01
saraswat cooperative bank credit card,2024-04-01,2025-10-01
saraswath cooperative bank,2024-04-01,2025-10-01
saraswati sahakari bank limited ozhar,2025-01-01,2025-10-01
sardar bhiladwala pardi people s cooperative bank,2024-04-01,2025-10-01
sardar bhilwada pardi peoples cop,2024-04-01,2025-10-01
sardar singh nagarik sahakari bank limited,2024-04-01,2025-10-01
sardar singh nagrik sahakari bank limited,2024-04-01,2025-10-01
sardar vallabhai co ban,2024-04-01,2025-10-01
sardar vallabhbhai sahakari bank limited,2024-04-01,2025-10-01
sardarganj mer cooperative bank limited anand,2024-04-01,2025-10-01
sardargunj mer cooperative bank limited patan,2024-04-01,2025-10-01
sardargunj mercantile cooperative bank,2024-04-01,2025-10-01
sarva harayana gramin bank,2024-04-01,2025-10-01
sarva haryana gramin bank,2024-04-01,2025-10-01
sarva up gramin bank,2024-04-01,2025-09-01
sarvodaya commercial cooperative bank limited,2024-04-01,2025-10-01
sarvodaya commercial cooperative bank limited mehsana,2024-04-01,2025-09-01
sarvodaya commerical cooperative bank limited,2024-04-01,2025-10-01
saurashtra gramin bank,2024-04-01,2025-09-01
saurashtra gramin bank imps,2024-04-01,2025-09-01
sawai madhopur urban cooperative bank limited,2024-04-01,2025-10-01
sbm bank,2025-01-01,2025-10-01
sbm bank india limited,2024-04-01,2025-10-01
sbpp cooperative bank limited,2024-04-01,2025-10-01
sbpp cooperative bank limited killa pardi,2024-04-01,2025-10-01
scdcc bank,2024-04-01,2025-10-01
sehore nagrik sahakari bank limited sehore,2024-04-01,2025-10-01
seven hills cooperative urban bank limited,2024-04-01,2025-10-01
shajapur nagrik sahakari bank limited shajapur,2024-04-01,2025-10-01
shalini sahakari bank limited,2024-04-01,2025-09-01
shankar nagari sahakari bank limited nanded,2024-04-01,2025-10-01
sharad nagari sahakari bank,2024-04-01,2025-10-01
sharad sahakari bank limited,2024-04-01,2025-10-01
sharad sahakari bank limited manchar,2024-04-01,2025-10-01
sharmik nagrik sahakari bank,2024-04-01,2025-10-01
shiggaon urban cooperative bank limited,2024-04-01,2025-10-01
shikshak sahakari bank limited,2024-04-01,2025-10-01
shikshak sahakari bank limited nagpur,2024-04-01,2025-09-01
shinhan bank,2024-04-01,2025-10-01
shiva sahakari bank niyamita,2024-04-01,2025-10-01
shiva sahakari bank niyamitha,2024-04-01,2025-10-01
shiva sahakari bank niyamitha davangere,2024-04-01,2025-10-01
shiva sahakari bank niyamitha tarikere,2024-04-01,2025-10-01
shivaji nagari sahakari bank limited,2024-04-01,2025-10-01
shivaji nagari sahakari bank limited paithan,2024-04-01,2025-10-01
shivalik merc cooperative bank limited,2024-04-01,2025-10-01
shivalik mercantile cooperative bank limited,2024-04-01,2025-10-01
shivalik small finance bank limited,2024-04-01,2025-10-01
shivdaulat sahakari bank limited satara,2024-04-01,2025-10-01
shivneri sahakari bank limited koregaon,2024-04-01,2025-02-01
shivshakti urban cooperative bank limited,2024-04-01,2025-10-01
shivshakti urban cooperative bank limited barshi,2024-04-01,2025-03-01
shm shri mahalaxmi cooperative bank limited,2024-04-01,2025-10-01
shramik nagrik sahakari bank limited,2024-04-01,2025-10-01
shree balaji urban cooperative bank limited,2024-04-01,2025-10-01
shree balaji urban cooperativerative bank limited,2024-04-01,2025-10-01
shree basaveshwar urban cooperative bank limited,2024-04-01,2025-10-01
shree basaveshwar urban cooperative bank limited raneb,2024-04-01,2025-10-01
shree basaveshwar urban cooperative bank limited ranebennur,2024-04-01,2025-10-01
shree bhailalbhai contractor smarak cooperative bank limited,2024-04-01,2025-10-01
shree bharat cooperative bank limited,2024-04-01,2025-10-01
shree bharat cooperative bank limited vadodara,2025-03-01,2025-03-01
shree bhav nag sahakari bank,2024-04-01,2025-10-01
shree bhavnagar nagrik sahakari bank limited,2024-04-01,2025-09-01
shree botad mercantile cooperative bank limited,2024-04-01,2025-10-01
shree cooperative bank limited,2024-04-01,2025-10-01
shree dhandhuka janta sahakari bank limited,2024-04-01,2025-10-01
shree dharati cooperative bank limited,2024-04-01,2025-10-01
shree dharti cooperative bank limited,2024-04-01,2025-10-01
shree gajanan urban cooperative bank limited,2024-04-01,2025-10-01
shree gavisiddheshwar urban cooperative bank limited,2024-04-01,2025-10-01
shree kadi nagarik sahakari bank limited,2024-04-01,2025-10-01
shree kadi nagrik sahakari bank limited kadi,2024-04-01,2025-10-01
shree laxmi cooperative bank limited,2024-04-01,2025-10-01
shree laxmi mahila sahakari bank limited mehsana,2024-04-01,2025-10-01
shree laxmi mahila sahakari bank limited sangli,2024-04-01,2025-10-01
shree lodra nagrik sahakari bank limited lodra,2024-04-01,2025-10-01
shree mahabaleshwar cooperative bank limited,2024-04-01,2025-09-01
shree mahalaxmhi sahakari bank,2024-04-01,2025-10-01
shree mahalaxmi urban cooperative credit bank limited,2024-04-01,2024-09-01
shree mahalaxmi urban cooperative credit bank limited gokak,2024-04-01,2024-08-01
shree mahavir sahakari bank limited,2024-04-01,2025-10-01
shree mahesh cooperative bank limited,2024-04-01,2025-10-01
shree mahesh cooperative bank limited nashik,2024-04-01,2025-10-01
shree mahuva nagarik sahakari bank limited,2024-04-01,2025-10-01
shree mahuva nagrik sahakari bank limited,2024-04-01,2025-10-01
shree morbi nagrik sahakari bank limited,2024-04-01,2025-10-01
shree murugharajendra cooperative bank limited,2024-04-01,2025-10-01
shree murugharajendra cooperative bank limited davangere,2024-04-01,2025-10-01
shree panchaganga nagari sahakari bank,2024-04-01,2025-10-01
shree panchganga nagari sahakari bank limited,2024-04-01,2025-10-01
shree parswanath cooperative bank limited,2024-11-01,2025-10-01
shree patneshwar urban cooperative bank limited,2024-04-01,2025-10-01
shree samarth cooperative bank limited,2024-04-01,2025-10-01
shree samarth sahakari bank limited nashik,2024-04-01,2025-10-01
shree savarkundla nagrik sahakari bank limited,2024-04-01,2025-10-01
shree talaja nagarik sahakari bank limited,2024-04-01,2025-10-01
shree talaja nagrik sahakari bank limited,2024-04-01,2025-10-01
shree thyagaraja cooperative bank limited,2024-04-01,2025-10-01
shree vardhaman sahakari bank limited,2024-04-01,2025-10-01
shree virpur urban cooperative bank limited,2024-04-01,2025-10-01
shree vyas dhanvarsha sahakari bank limited yaval,2024-04-01,2025-10-01
shree warana sahakari bank limited,2024-04-01,2025-10-01
shree warana sahakari bank limited warananagar,2024-04-01,2025-10-01
shri adinath cooperative bank limited,2024-04-01,2025-10-01
shri adinath cooperative bank limited ichalkaranji,2024-04-01,2025-10-01
shri anand nagari sahakari bank limited,2024-04-01,2025-10-01
shri arihant cooperative bank limited,2024-04-01,2025-10-01
shri bagasara nagrik sahakari bank limited,2024-04-01,2025-10-01
shri baria nagrik sahakari bank limited,2024-04-01,2025-10-01
shri basaveshwar sahakari bank nyt,2024-04-01,2025-10-01
shri basaveshwar sahakari bank nyt bagalkot,2024-04-01,2025-10-01
shri basaveshwar urban cooperative bank limited,2024-04-01,2025-10-01
shri bharat urban cooperative bank limited jaysingpur,2024-04-01,2025-10-01
shri bhausaheb thorat amrutvahini sahakari bank lt,2024-04-01,2025-10-01
shri chatrapati shivaji maharaj sahakari bank niya,2024-04-01,2025-10-01
shri chatrapati shivaji maharaj sahakari bank niyamith,2024-04-01,2025-10-01
shri chatrapati shivaji maharaj sahakari bank niyamith gulbarga,2024-04-01,2025-10-01
shri chatrapti rajarshi shahu bank,2024-04-01,2025-10-01
shri chhani nagrik sahakari bank limited,2024-04-01,2025-10-01
shri chhatrapati rajarshi shahu urban cooperative bank,2024-04-01,2025-10-01
shri chhatrapati rajarshi shahu urban cooperative bank limited beed,2024-04-01,2025-10-01
shri d t patil cooperative bank limited,2024-04-01,2025-10-01
shri d t patil cooperative bank limited chikodi,2024-04-01,2025-10-01
shri durgadevi mahila sahakari bank niyamith,2024-04-01,2025-10-01
shri durgadevi mahila sahakari bank niyamitha,2024-04-01,2025-10-01
shri gajanan lokseva sahakari bank limited,2025-05-01,2025-10-01
shri gajanan maharaj urban cooperative bank limited,2024-04-01,2025-10-01
shri gajanan maharaj urban cooperative bank limited bhokarda,2024-04-01,2025-10-01
shri gajanan maharaj urban cooperative bank limited bhokardan,2024-04-01,2025-10-01
shri gajanan nagari sahakari bank limited,2024-04-01,2025-10-01
shri gajanan nagari sahakari bank limited beed,2024-04-01,2025-10-01
shri ganesh sahakari bank limited,2024-04-01,2025-09-01
shri ganesh sahakari bank limited nashik,2025-10-01,2025-10-01
shri ganesh sahakri bank limited pune,2024-04-01,2025-10-01
shri gowardhansinghi raghuvanshi sahakri bank limited,2024-04-01,2025-10-01
shri gurusiddheshwar cooperative bank limited,2024-04-01,2025-10-01
shri janata sahakari bank limited halol,2024-04-01,2025-10-01
shri kadasiddeshwar pattan sahakari bank niyamit,2024-04-01,2025-10-01
shri kanyaka nagari sahakari bank limited,2024-04-01,2025-10-01
shri kanyaka nagari sahakari bank limited chandrapur,2024-04-01,2025-09-01
shri laxmikrupa urban cooperative ban,2024-04-01,2025-10-01
shri laxmikrupa urban cooperative bank limited pune,2024-04-01,2025-10-01
shri mahalaxmi cooperative bank limited,2024-04-01,2025-10-01
shri mahalaxmi cooperative bank limited kolhapur,2024-04-01,2025-10-01
shri mahant shivayogi sahakari bank limited,2024-04-01,2025-10-01
shri mahaveer urban cooperative bank limited,2024-04-01,2025-10-01
shri mahavir urban cooperative bank limited,2025-01-01,2025-10-01
shri mahavir urban cooperative bank limited solapur,2024-04-01,2025-09-01
shri mahila sewa sahakari bank limited,2024-04-01,2025-10-01
shri narsinha saraswati sahakri bank limited,2024-04-01,2025-09-01
shri panchaganga nagri sahakari bank limited,2024-04-01,2025-10-01
shri rajkot district cooperative bank limited,2024-04-01,2025-10-01
shri rukmini sahakari bank limited,2024-04-01,2025-10-01
shri shantappanna miraji urban cooperative bank limited,2024-04-01,2025-10-01
shri sharan veereshawar sahakari bank niyamit,2024-11-01,2025-01-01
shri sharan veereshwar sahakari bank niya nalatwad,2024-04-01,2025-10-01
shri shiddeshwar cooperative bank limited,2024-04-01,2025-10-01
shri shiddheshwar cooperative bank limited vijaypur,2024-04-01,2025-10-01
shri shivayogi murughendra swami urban cooperative bank l,2024-04-01,2025-10-01
shri shivayogi murughendra swami urban cooperative bank limited,2024-04-01,2025-10-01
shri shiveshwar nagari sahakari bank limited,2024-04-01,2025-10-01
shri shiveshwar nagari sahakari bank limited basmath,2024-04-01,2025-10-01
shri siddeshwar cooperative bank limited,2024-12-01,2025-10-01
shri siddeshwar cooperative bank limited ranebennur,2024-04-01,2025-10-01
shri swami samarth sahakari bank limited,2024-04-01,2025-10-01
shri veer pulikehi cooperative bank limited,2024-04-01,2025-10-01
shri veershaiv cooperative bank limited,2024-04-01,2025-10-01
shri veershaiv cooperative bank limited kolhapur,2024-04-01,2025-10-01
shri vijay mahantesh cooperative bank limited,2024-04-01,2025-10-01
shri vinayak sahakari bank limited,2024-04-01,2025-10-01
shri vyankatesh cooperative bank limited,2024-04-01,2025-10-01
shri warana sahakari bank limited,2024-04-01,2025-10-01
shri yashwant sahakari bank limited kuditre,2024-04-01,2025-10-01
shrikrishna cooperative bank limited,2024-04-01,2025-10-01
shrikrishna cooperative bank limited umrer,2024-04-01,2025-10-01
shrimant malojiraje sahakari bank,2024-04-01,2025-10-01
shrimant malojiraje sahakari bank limited phaltan,2024-04-01,2025-10-01
shripatrao dada sahakari bak limited,2024-04-01,2025-10-01
shriram urban cooperative bank limited,2024-04-01,2025-10-01
shriram urban cooperative bank limited nagpur,2024-04-01,2025-09-01
shubhlaxmi mahila cooperative bank,2024-04-01,2025-10-01
