Bank,First_Active_Month,Last_Active_Month
0,2025-09-01,2025-09-01
510 army base workshop credit cooperative primary bank limited,2024-04-01,2025-10-01
a b e cooperative bank limited,2024-04-01,2025-10-01
a p mahesh cooperative urban bank limited prepaid acm,2024-04-01,2025-02-01
a p state cooperative bank limited,2024-04-01,2025-10-01
abasaheb patil rendal sahakari bank limited rendal,2024-04-01,2025-10-01
abhinandan urban cooperative bank limited,2024-04-01,2025-10-01
abhinandan urban cooperative bank limited amravati,2024-04-01,2025-10-01
abhivriddhi mahila sahakara bank niyamita,2024-04-01,2025-10-01
abhyudaya cooperative bank limited,2024-04-01,2025-10-01
abhyudaya mahila urban cooperative bank limited channapatna,2024-12-01,2025-10-01
ace cooperative bank limited,2024-04-01,2025-10-01
adarniya p d patil sahakari bank,2024-04-01,2025-10-01
adarniya p d patilsaheb sahakari bank limited karad,2024-04-01,2025-10-01
adarniya pd patil bank,2024-04-01,2025-10-01
adarsh cooperative bank hyderabad,2024-04-01,2025-10-01
adarsh cooperative bank limited,2024-04-01,2025-10-01
adarsh cooperative bank limited rajasthan,2024-04-01,2025-10-01
adarsh mahila mercantile cooperative bank limited,2024-04-01,2025-10-01
adhyapaka urban cooperative bank limited,2024-04-01,2025-10-01
adinath cooperative urban bank,2024-04-01,2025-10-01
adv shamraoji shinde satyashodhak sahakar bank limited,2024-04-01,2025-10-01
agartala cooperative urban bank limited,2024-04-01,2025-10-01
agra zila sahakari bank limited,2024-04-01,2025-10-01
agroha cooperative bank limited,2024-04-01,2025-10-01
agroha cooperative urban bank limited,2024-04-01,2025-10-01
ahilyadevi urban cooperative bank limited,2025-02-01,2025-10-01
ahmedabad dist cooperative bank,2024-04-01,2025-10-01
ahmedabad merc cooperative bank limited,2024-04-01,2025-10-01
ahmednagar merchants cooperative bank limited,2024-04-01,2025-10-01
ahmednagar shahar sahakari bank limited,2024-04-01,2025-10-01
ahmednagar zilha prathmik shikshak sahakari bank limited,2025-07-01,2025-09-01
ahmednagar zilha prathmik shikshak sahakari bank limited ahmednagar,2024-04-01,2025-10-01
ahmednagar zilla prathmik shikshak sahakari bank l,2024-04-01,2025-10-01
ajinkyatara mahila sahakari bank limited satara,2024-04-01,2025-04-01
ajmer central cooperative bank limited,2024-04-01,2025-10-01
akhand anand cooperative bank limited,2024-04-01,2025-10-01
akola janata comm cooperative bank limited,2024-04-01,2025-10-01
akola merchant cooperative bank limited akola,2024-04-01,2024-04-01
alavi cooperative bank limited,2024-04-01,2025-10-01
alibag cooperative urban bank limited alibag,2024-04-01,2025-10-01
aligarh district cooperative bank limited aligarh,2024-04-01,2025-10-01
aligarh zila sahakari bank limited,2024-04-01,2025-10-01
allahabad bank,2024-04-01,2025-10-01
allahabad district central cooperative bank limited,2024-04-01,2025-10-01
allahabad district cooperative bank limited,2024-04-01,2025-10-01
almora urban cooperative bank limited,2024-04-01,2025-10-01
almora zila sahakari bank limited,2024-04-01,2025-10-01
almora zila sahakari bank limited almora,2024-04-01,2025-10-01
alwayeurbancoopbankltd 466,2024-04-01,2025-10-01
aman sahakari bank limited,2024-04-01,2025-10-01
aman sahakari bank limited ichalkaranji,2024-04-01,2025-10-01
amanath cooperative bank limited,2024-04-01,2024-05-01
amarnath cooperative bank limited,2024-04-01,2025-10-01
amazon,2024-04-01,2025-10-01
ambajogai peoples cooperative bank limited,2024-04-01,2025-10-01
ambarnath jai hind cooperative bank limited,2024-04-01,2025-10-01
amravati merchant cooperative bank limited,2024-04-01,2025-10-01
amravati zilla mahila sahakari bank limited,2024-04-01,2025-10-01
amreli nagarik sahakari bank limited,2024-04-01,2025-10-01
amreli nagrik sahakari bank limited,2024-04-01,2025-10-01
amrelli jilla madhyastha sahakari bank limited amreli,2024-04-01,2025-10-01
anand nagari sahakari bank limited nagpur,2024-04-01,2025-10-01
anandeshwari nagarik sahakari bank limited ujjain,2024-04-01,2025-10-01
andaman and nicobar state cooperative bank limited,2024-04-01,2025-10-01
andarsul urban cooperative bank limited andarsul,2025-03-01,2025-10-01
andhra pradesh gamen vikas bank,2024-04-01,2025-10-01
andhra pradesh grameena bank,2025-10-01,2025-10-01
andhra pradesh grameena vikas bank,2024-04-01,2025-10-01
andhra pradesh grameena vikas bank imps,2024-04-01,2025-10-01
andhra pradesh grameena vikash bank,2024-04-01,2025-10-01
andhra pradesh gramin vikas bank,2024-04-01,2025-10-01
andhra pragati gramin bank,2024-04-01,2025-10-01
andman and nicobar scb limited,2024-04-01,2025-10-01
angul central cooperative bank limited,2024-04-01,2025-10-01
annasaheb chougule urban cooperative bank limited,2024-04-01,2025-10-01
annasaheb magar sahakari bank limited,2024-04-01,2025-10-01
annasaheb magar sahakari bank limited bhosari,2024-04-01,2025-10-01
annual pass,2025-08-01,2025-09-01
anuradha urban cooperative bank limited chikhil,2024-04-01,2025-10-01
ap janata cooperative urban bank limited,2024-04-01,2025-10-01
ap mahesh cooperative bank,2024-04-01,2025-10-01
apna sahakari bank limited,2024-04-01,2025-10-01
apni sahakari bank limited,2024-04-01,2025-10-01
appasaheb birnale sahakari bank limited,2024-04-01,2025-10-01
appasaheb birnale sahakari bank limited dudhgaon,2024-04-01,2025-10-01
appnit technologies private limited,2024-04-01,2025-10-01
aruna sahakara bank niyamitha,2025-09-01,2025-09-01
arunachal pradesh rural bank,2024-04-01,2025-10-01
arvind sahakari bank limited,2024-04-01,2025-10-01
aryavart bank,2024-04-01,2025-09-01
aryavart bank erstwhile gramin bank of aryavart,2024-04-01,2025-09-01
ashok sahakari bank limited,2024-04-01,2025-10-01
ashokanagar cooperative bank limited,2024-04-01,2025-09-01
assam gramin vikash bank,2024-04-01,2025-10-01
astha mahila nagrik sahakari bank limited,2024-04-01,2025-10-01
au small finance bank credit card,2024-04-01,2025-10-01
au small finance bank limited,2024-04-01,2025-10-01
aurangabad dist central co bank,2024-04-01,2025-10-01
australia and newzealand banking group limited,2024-04-01,2025-10-01
axis bank limited,2024-04-01,2025-10-01
bahraich district cooperative bank limited bahraich,2024-04-01,2025-10-01
bajaj finance limited,2024-04-01,2025-10-01
bajirao appa sahakari bank limited ankalkhop,2024-04-01,2025-10-01
balageria central cooperative bank limited,2024-04-01,2025-10-01
balancehero india private limited,2024-04-01,2025-10-01
balangir central cooperative bank limited,2024-04-01,2025-10-01
balasinor nagarik sahakari bank limited,2024-04-01,2024-06-01
balasinor nagrik sahakari bank limited,2024-04-01,2024-05-01
balitikuri cooperative bank limited,2024-04-01,2025-10-01
bally cooperative bank limited,2024-04-01,2025-10-01
banaskantha mercantile cooperative bank limited palanpur,2024-04-01,2025-10-01
banda district cooperative bank limited,2024-04-01,2025-10-01
banda urban cooperative bank limited,2024-04-01,2025-10-01
banda urban cooperative bank limited banda,2024-04-01,2025-10-01
bandhan bank limited,2024-04-01,2025-10-01
bangiya gramin vikash bank,2024-04-01,2025-10-01
bank of america,2024-04-01,2025-10-01
bank of america n a,2024-04-01,2025-10-01
bank of bahrain and kuwait b s c,2024-04-01,2025-10-01
bank of bahrain kuwait,2024-04-01,2025-09-01
bank of ceylon boc,2024-04-01,2025-10-01
bank of china limited,2024-11-01,2025-10-01
bank of india,2024-04-01,2025-10-01
bank of maharashtra,2024-04-01,2025-10-01
bank of nova scotia,2024-04-01,2024-05-01
bankura district central cooperative bank limited,2024-04-01,2025-10-01
baramulla central cooperative bank limited,2024-04-01,2025-10-01
baran kendriya sahakari bank limited,2024-04-01,2025-10-01
baran nagarik sahakari bank limited baran,2024-04-01,2025-10-01
barclays bank,2024-04-01,2025-10-01
barclays bank plc,2024-04-01,2025-10-01
baroda guj gramin bank limited,2024-04-01,2025-09-01
baroda gujarat gramin bank,2024-04-01,2025-10-01
baroda gujrat gramin bank,2024-04-01,2025-10-01
baroda rajasthan gramin bank,2024-04-01,2025-08-01
baroda rajasthan kshetriya gramin bank,2024-04-01,2025-09-01
baroda u p bank,2024-04-01,2025-10-01
baroda u p bank erstwhile baroda uttar pradesh gramin bank,2024-04-01,2024-12-01
baroda uttar pradesh gramin bank,2024-04-01,2025-10-01
basien catholic cooperative bank,2024-04-01,2025-10-01
basoda nagrik sahakari bank limited,2024-04-01,2025-10-01
bassein catholic cooperative bank limited,2024-04-01,2025-10-01
beawer urban cooperative bank limited,2024-04-01,2025-10-01
belagavi shree basaveshwar cooperative bank limited,2024-04-01,2025-10-01
belagavi shree basveshwar cooperative,2024-04-01,2025-10-01
belgaum dccb limited,2024-04-01,2025-10-01
belgaum zilla rani channamma mahila sahakari bank,2024-04-01,2025-10-01
belgaum zilla rani channamma mahila sahakari bank niyamit belgaum,2024-04-01,2025-10-01
bellad bagewadi urban souharada sahakari bank nyt,2024-04-01,2025-10-01
bellad bagewadi urban souhard sahakari bank nyt,2024-04-01,2025-10-01
bellad begewadi urban souhard sahakari,2024-04-01,2025-10-01
belur urban cooperative bank limited,2024-04-01,2025-10-01
betul nagrik sahakari bank limited,2024-04-01,2025-10-01
betul nagrik sahakari bank mydt,2024-04-01,2025-10-01
bhadohi urban cooperative bank limited gyanpur,2024-04-01,2025-10-01
bhadradri cooperative bank,2024-04-01,2025-10-01
bhadradri cooperative urban bank limited,2024-04-01,2025-10-01
bhagini nivedita sahakari bank limited,2024-04-01,2025-10-01
bhagini nivedita sahakari bank limited pune,2024-04-01,2025-10-01
bhagyalaksmi mahila sahakari bank,2024-04-01,2025-10-01
bhandara district central cooperative bank,2024-04-01,2025-10-01
bharat heavy electricals employees cooperative bank limited,2024-04-01,2025-10-01
bharathiya sahakara bank niyamitha,2024-04-01,2025-10-01
bharati sahakari bank limited,2024-04-01,2025-10-01
bharati sahakari bank limited pune,2024-04-01,2025-10-01
bhatpara naihati cooperative bank limited,2024-04-01,2025-10-01
bhausaheb birajdar nagri sahakari bank,2024-04-01,2025-10-01
bhausaheb birajdar urban cooperative bank limited omerga,2024-04-01,2025-10-01
bhausaheb sahakari bank limited udgir,2024-04-01,2025-10-01
bhavani sahakari bank limited,2024-04-01,2025-07-01
bhavani urban cooperative bank limited georai,2024-04-01,2025-10-01
bhavani urban cooperative bank limited georai dist beed,2024-04-01,2025-10-01
bhavna rishi cooperative urban bank limited,2024-04-01,2025-10-01
bhavnagar district cooperative bank limited,2024-04-01,2025-10-01
bhilai nagrik sahakari bank limited limited,2024-04-01,2025-10-01
bhilwara urban cooperative bank limited,2024-04-01,2025-10-01
bhind nagrik sahakari bank limited bhind,2024-04-01,2025-10-01
bhingar urban cooperative bank limited,2024-04-01,2025-10-01
bhopal cooperative central bank limited,2024-04-01,2025-10-01
bihar gramin bank,2024-04-01,2025-10-01
bilagi pattan sahakari bank niyamit,2024-04-01,2025-10-01
bilaspur nagrik sahakari bank limited,2024-04-01,2025-10-01
birbhum district central cooperative bank limited,2024-04-01,2025-10-01
birdeo sahakari bank limited,2024-04-01,2025-10-01
bnp paribas bank,2024-04-01,2025-10-01
bnp paribas bnp,2024-04-01,2025-10-01
bombay mercantile cooperative bank limited,2024-04-01,2025-10-01
bombay mercantile cooperative bank lt,2024-04-01,2025-10-01
brahmadeodada mane sahakari bank limited,2024-04-01,2025-10-01
brahmadeodada mane sahakari bank limited solapur,2024-04-01,2025-10-01
brahmapuri urban cooperative bank limited,2024-04-01,2025-10-01
bramhapuri urban cooperative bank limited,2024-04-01,2025-10-01
budaun zila sahakari bank limited,2024-04-01,2025-10-01
budaun zila sahakari bank limited budaun,2024-04-01,2025-10-01
c g rajya sahakari bank mydt raipur,2024-04-01,2025-10-01
canara bank,2024-04-01,2025-10-01
canara bank credit card,2024-04-01,2025-10-01
capital small finance bank limited,2024-04-01,2025-10-01
catholic syrian bank,2024-04-01,2025-10-01
central bank of india,2024-04-01,2025-10-01
central cooperative bank limited ara,2024-04-01,2025-10-01
central madhya pradesh gramin bank,2024-04-01,2024-05-01
cg rajya sahakari bank limited,2024-04-01,2025-10-01
chaitanya godavari grameena bank,2024-04-01,2025-10-01
chaitanya godavari gramin bank,2024-04-01,2025-10-01
chaitanya mahila sahakari bank limited bijapur,2024-04-01,2025-09-01
chaitanya mahila sahakari bank limited vijayapur,2024-04-01,2025-10-01
chamoli zila sahakari bank limited,2024-04-01,2025-10-01
chartered sahakari bank niyamitha,2024-04-01,2025-10-01
chattisgarh rajya gramin bank,2024-04-01,2025-10-01
chattisgarh rajya sahakari bank limited,2024-04-01,2025-10-01
chattishgarh rajya gramin bank,2024-04-01,2025-10-01
cherpalcheri cooperative urban bank,2024-04-01,2025-09-01
cherpalcheri cooperative urban bank limited no 1696,2024-04-01,2025-10-01
chhani nagarik sahakari bank limited,2024-04-01,2025-10-01
chhattisgarh rajya gramin bank,2024-04-01,2025-10-01
chhattisgarh rajya sahakari bank mydt,2024-04-01,2025-10-01
chikmagalur jilla mahila sahakara bank niyamitha,2024-04-01,2025-09-01
chikmagalur pattana sahakara bank niyamitha,2024-04-01,2025-10-01
chitnavispura cooperative bank limited,2024-04-01,2025-10-01
chittorgarh kendriya sahakari bank limited chittorgarh,2024-04-01,2025-09-01
chittorgarh urban cooperative bank limited,2024-04-01,2025-10-01
churu zila urban cooperative bank limited,2024-04-01,2025-10-01
citi bank,2024-04-01,2025-10-01
citi bank integra,2024-04-01,2025-10-01
citibank,2024-04-01,2024-07-01
citibank corporate,2024-04-01,2025-10-01
citizen cooperative bank limited,2024-04-01,2025-10-01
citizen cooperative bank limited noida,2024-04-01,2025-10-01
citizen credit cooperative bank limited,2024-04-01,2025-10-01
citizen urban cooperative bank,2024-04-01,2025-10-01
city union bank limited,2024-04-01,2025-10-01
coastal area local bank,2024-04-01,2025-10-01
coastal local area bank limited,2024-04-01,2025-10-01
col rd nikam sainik sahakari bank limited,2024-04-01,2025-10-01
commercial cooperative bank limited jam nagar,2025-01-01,2025-10-01
contai cooperative bank limited,2024-04-01,2025-10-01
cooperative bank of baroda limited,2024-04-01,2025-10-01
credit agricole corporate and investment bank,2024-04-01,2025-10-01
credit suisse ag bank limited,2024-04-01,2025-10-01
csb bank limited,2024-04-01,2025-10-01
csc e governance services india limited,2024-04-01,2025-10-01
cuttack central cooperative bank limited,2024-04-01,2025-10-01
cuttack central cooperative bank limited cuttack,2024-04-01,2025-10-01
dadasaheb ramroa patil cooperative bank limited,2024-04-01,2025-10-01
dahanu road janata cooperative bank limited,2024-04-01,2025-10-01
daivadnya sahakara bank niyamit,2024-04-01,2025-10-01
daivadnya sahakara bank niyamit karnataka,2024-04-01,2025-10-01
dakshin bihar gramin bank,2024-04-01,2025-10-01
dakshin bihar gramin bank erstwhile madhya bihar gramin bank,2024-04-01,2025-10-01
dapoli urban cooperative bank limited,2024-04-01,2025-10-01
dapoli urban cooperative bank limited dapoli,2024-04-01,2025-10-01
darjeeling district central cooperative bank limited,2024-04-01,2025-10-01
darjeeling district central cooperativebank limited,2025-03-01,2025-10-01
dattatray maharaj kalambe jaoli sahakari bank limited,2024-04-01,2025-10-01
dattatraya maharaj kalambe jaoli sahakari bank limited,2024-04-01,2025-10-01
dattatraya maharaj kalambe jaoli sb,2024-04-01,2025-10-01
daund urban cooperative bank limited daund,2024-04-01,2025-10-01
dausa kendriya sahakari bank limited dausa,2024-04-01,2025-04-01
dausa urban cooperative bank limited,2024-04-01,2025-10-01
davanagere district central cooperative bank limited,2024-04-01,2025-10-01
davanagere district central cooperative bank limited davanagere,2024-04-01,2025-09-01
dbs bank india limited,2024-04-01,2025-10-01
dcb bank limited,2024-04-01,2025-10-01
dccb dehradun,2024-04-01,2025-10-01
deccan merchants cooperative bank limited dmc,2024-04-01,2025-10-01
deendayal nagari sahakari bank limited,2024-04-01,2025-10-01
deendayal nagri sahakari bank limited,2024-04-01,2025-10-01
delhi nagrik sahakari bank limited,2024-04-01,2025-10-01
delhi state cooperative bank limited,2024-04-01,2025-10-01
deogiri nagari sahakari bank limited,2024-04-01,2025-10-01
deogiri nagari sahakari bank limited aurangabad,2024-04-01,2025-10-01
deoria kasia district cooperative bank limited,2024-04-01,2025-10-01
deoria kasia district cooperative bank limited deoria,2025-01-01,2025-10-01
department of post,2024-04-01,2025-10-01
desaiganj nagari cooperative bank limited,2024-04-01,2025-10-01
deutsche bank limited,2024-04-01,2025-10-01
development bank of singapore,2024-04-01,2025-10-01
development cooperative bank limited kanpur,2024-04-01,2025-10-01
development credit bank limited,2024-04-01,2025-10-01
devi gayatri cooperative urban bank limited,2024-04-01,2025-10-01
devika urban cooperative bank limited,2024-04-01,2025-10-01
dhakuria cooperative bank limited,2024-04-01,2025-10-01
dhanalakshmi bank limited,2024-04-01,2025-10-01
dhanlaxmi bank limited,2024-04-01,2025-10-01
dharmapuri district central cooperative bank limited,2024-04-01,2025-10-01
dharmavir sambhaji urban cooperative bank limited,2024-04-01,2025-10-01
dhule and nandurbar jilha sarkari nokaranchi bank,2024-04-01,2025-10-01
dhule vikas sahakari bank limited,2024-04-01,2025-10-01
dhule vikas shakari bank limited,2024-04-01,2025-10-01
dilip urban cooperative bank limited,2024-04-01,2025-10-01
dindigul district central cooperative bank,2024-04-01,2025-10-01
district central cooperative bank limited supaul,2024-04-01,2025-10-01
district cooperative bank limited,2024-04-01,2025-10-01
district cooperative bank limited ayodhya,2025-07-01,2025-10-01
district cooperative bank limited barabanki,2024-04-01,2025-10-01
district cooperative bank limited bijnor,2024-04-01,2025-10-01
district cooperative bank limited dehradun,2024-04-01,2025-10-01
district cooperative bank limited faizabad,2024-04-01,2025-06-01
district cooperative bank limited kanpur,2024-04-01,2025-09-01
district cooperative bank limited mainpuri,2024-04-01,2025-10-01
district cooperative bank limited pilibhit,2024-04-01,2025-10-01
district cooperative bank limited pratapgarh,2024-04-01,2025-10-01
district cooperative bank limited raebareli,2024-04-01,2025-10-01
district cooperative bank limited saharanpur,2024-04-01,2025-10-01
district cooperative bank limited sharanpur,2024-04-01,2025-10-01
district cooperative bank limited sitapur,2024-04-01,2025-10-01
district cooperative bank limited varanasi,2025-05-01,2025-10-01
district cooperative bank shahjahanpur,2024-04-01,2025-09-01
district cooperative central bank vishakhapatnam,2024-04-01,2025-10-01
doha bank qsc,2024-04-01,2025-10-01
dombivili nagari sahakari bank limited,2024-04-01,2025-10-01
dombivli nagari sahakari bank,2024-04-01,2025-10-01
dombivli nagari sahakari bank limited dsb,2024-04-01,2025-10-01
dombivli nagarik sahakari bank,2024-04-01,2025-10-01
dombivli nagri sahakari b ank limited,2024-04-01,2025-10-01
dombivli nagri sahakari bank limited,2025-02-01,2025-08-01
dr ambedkar nagrik sahakari bank,2024-04-01,2025-10-01
dr annasaheb choughule urban cooperative bank,2024-04-01,2025-10-01
dr annasaheb chougule cooperativet bank,2024-04-01,2025-10-01
dr appasaheb urf sa re patil jaysingpur udgaon sahakari bank limited jaysingpur,2024-04-01,2025-10-01
dr appasaheb urfsa re patiljaysingpurudgaonbankltd,2024-04-01,2025-10-01
dr appashab jasingpur udgaon bank,2024-04-01,2025-10-01
dr babasaheb ambedkar bank limited,2024-04-01,2025-10-01
dr jaiprakash mundada urban cooperative bank limited,2024-04-01,2025-10-01
dr panjabrao deshmukh urban cooperative bank limited,2024-04-01,2025-10-01
dreamplug paytech solutions private limited,2024-09-01,2025-10-01
dreampurse technologies pvt limited,2025-03-01,2025-10-01
durgapur steel peoples cooperative babk limited,2024-04-01,2025-10-01
durgapur steel peoples cooperative bank limited,2024-04-01,2025-10-01
durgapur steel peoples cooperative bankltd,2024-12-01,2025-10-01
dwarakadas mantri nagari sahakari bank limited,2024-04-01,2025-10-01
easebuzz private limited,2025-02-01,2025-10-01
ellaquai dehati bank,2024-04-01,2025-09-01
emirates nbd bank,2024-04-01,2025-10-01
equitas small finance bank limited,2024-04-01,2025-10-01
eroute,2025-09-01,2025-10-01
eroute technologies private limited,2024-04-01,2025-10-01
eroute technologies private limited prepaid,2024-04-01,2025-09-01
esaf small finance bank limited,2024-04-01,2025-10-01
etah district cooperative bank limited,2024-04-01,2025-10-01
etah district cooperative bank limited etah,2024-04-01,2025-09-01
etah urban cooperative bank limited,2024-04-01,2025-10-01
etawah dccb etawah,2024-04-01,2025-10-01
etawah district cooperative bank limited,2024-04-01,2025-10-01
etawah urban cooperative bank limited,2024-04-01,2025-10-01
euronet services india private limited,2024-04-01,2025-10-01
euronet services india pvt limited,2025-02-01,2025-05-01
faizabad cooperative district bank limited faizabad,2024-04-01,2025-08-01
fincare small finance bank limited,2024-04-01,2024-12-01
fingrowth cooperative bank limited,2024-04-01,2025-10-01
firozabad zila sahakari bank limited,2024-04-01,2025-10-01
firozabad zila sahakari bank limited firozabad,2024-04-01,2025-10-01
g p parsik sahakari bank limited,2024-04-01,2025-10-01
gadchirolli district cooperative bank,2024-04-01,2025-10-01
gadhinglaj urban cooperative bank limited,2024-04-01,2025-10-01
gandhibag sahakari bank limited nagpur,2024-04-01,2025-10-01
gandhibagh sahakari bank limited,2024-04-01,2025-10-01
ganesh sahakari ban limited,2024-04-01,2025-09-01
ganraj nagari sahakari bank limited beed,2024-04-01,2025-10-01
garagepreneurs internet private limited slice,2024-04-01,2025-02-01
gautam sahakari bank limited,2024-11-01,2025-10-01
gautam sahakari bank limited gautamnagar,2024-04-01,2025-10-01
gayatri cooperativet urban bank,2024-04-01,2025-10-01
general post office,2024-04-01,2025-10-01
george town cooperative bank limited,2024-04-01,2025-10-01
gipl slice,2024-04-01,2024-05-01
godavari laxmi cooperative bank limited jalgaon,2024-04-01,2025-10-01
godavari urban cooperative bank limited,2024-04-01,2025-10-01
godavari urban cooperative bank limited nashik,2024-04-01,2025-10-01
godavari urban cooperative bank limited vazirabad nanded,2024-04-01,2025-03-01
gondal nagarik sahakari bank limited,2024-04-01,2025-10-01
gondal nagrik sahakari bank limited,2024-04-01,2025-09-01
gondia district central cooperative bank limited gondia,2024-04-01,2025-10-01
gopinath patil parsik janta bank,2024-04-01,2025-10-01
guardian souharda sahakari bank,2024-10-01,2025-10-01
gujarat ambuja cooperative bank limited,2024-04-01,2025-10-01
gujarat gramin bank,2025-10-01,2025-10-01
gujarat mercantile cooperative bank limited,2024-04-01,2025-10-01
gujrat state cooperative bank,2024-04-01,2025-10-01
gulbarga yadgir dist cooperative central bank,2024-04-01,2025-10-01
gulshan mercantile urban cooperative bank limited,2024-04-01,2025-10-01
guna nagarik sahakari bank limited,2024-04-01,2025-09-01
guna nagarik sahakari bank limited guna,2024-04-01,2025-10-01
hadagali urban cooperative bank limited,2024-04-01,2025-10-01
hadagali urban cooperative bank limited hadagali,2024-04-01,2025-10-01
hamirpur district cooperative bank limited,2024-04-01,2025-10-01
hamirpur district cooperative bank limited mahoba,2024-04-01,2025-10-01
hanamasagar urban cooperative bank limited,2024-04-01,2025-10-01
hanamasagar urban cooperative bank limited hanamasagar,2024-04-01,2025-10-01
hardoi district cooperative bank limited,2024-05-01,2025-10-01
haveli sahakari bank limited,2024-04-01,2025-09-01
haveli sahakari bank limited moshi,2024-04-01,2025-10-01
hdfc bank limited,2024-04-01,2025-10-01
himatnagar nagarik sahakari bank limited,2024-04-01,2025-10-01
himatnagar nagrik sahakari bank,2024-04-01,2025-10-01
hindon mercantile limited,2024-04-01,2025-10-01
hindu cooperative bank limited pathankot,2025-05-01,2025-10-01
hisar centralcooperative bank limited,2024-04-01,2025-10-01
hissar urban cooperative bank limited hisar,2024-04-01,2025-09-01
hooghly district central cooperative bank limited,2024-04-01,2025-10-01
hoogly district central coopeartive bank,2024-04-01,2025-09-01
hsbc bank,2024-04-01,2025-10-01
hubli urban cooperative bank limited,2024-04-01,2025-09-01
hutatma sahakari bank limited,2024-04-01,2025-10-01
hutatma sahakari bank limited walwa,2024-04-01,2025-10-01
hutatma sahakari bank walawa,2024-04-01,2025-10-01
icici bank limited,2024-04-01,2025-10-01
icici bank pockets ipp,2024-04-01,2024-12-01
icici banking corporation limited,2024-04-01,2025-10-01
idbi bank limited,2024-04-01,2025-10-01
idfc bank,2024-04-01,2025-10-01
idfc bank credit card,2024-06-01,2025-10-01
idfc first bank limited,2024-04-01,2025-10-01
imperial urban cooperative bank limited faziabad,2024-04-01,2025-10-01
indapur urban cooperative bank limited,2024-04-01,2025-10-01
indapur urban cooperative bank limited indapur,2024-04-01,2025-09-01
india ideas com limited,2024-04-01,2025-10-01
india transact services limited its,2024-11-01,2025-09-01
indian bank,2024-04-01,2025-10-01
indian bank credit card,2024-04-01,2024-05-01
indian overseas bank,2024-04-01,2025-10-01
indira mahila sahakari bank limited malegaon,2024-04-01,2025-10-01
indira mahila sahakari bank limited nandurbar,2024-04-01,2025-10-01
indira mahilanagari sahakari bank limited latur,2024-04-01,2025-10-01
indore cloth market cooperative bank limited,2024-04-01,2025-10-01
indore paraspar sahakari bank limited,2024-04-01,2025-10-01
indore paraspar sahakari bank limited indore,2024-04-01,2025-10-01
indore premier cooperative bank limited,2024-04-01,2025-10-01
indore swayamsiddh mahila cooperative bank limited indore,2024-04-01,2025-09-01
indraprastha seh bank limited,2024-04-01,2025-10-01
indraprastha sehkari bank limited,2024-04-01,2025-10-01
indrayani cooperative bank limited,2024-04-01,2025-10-01
indrayani cooperative bank limited pimpri,2024-04-01,2025-10-01
indus ind bank limited,2024-04-01,2025-10-01
industrial bank of korea,2024-04-01,2025-09-01
